,Name,catagory,description,sub_catagory,Veg_Non,Review,Nutrient,Price
334,Plum And Cherry Roasted Chicken,chicken," Carrot (finely diced), Onion (finely diced), Celery (finely diced), Fresh thyme sprigs, Whole free range chicken , Pepper (freshly ground), Parsley stems, Celery leaves, Lemon slices (1/8 inch thick), Onion, Carrot, Fresh lemon juice, Chicken stock/broth, Plums (cut), Fresh cherries",,non-veg,3,Iron,335
335,Methi Murgh,chicken," chicken breast (boneless, cut into 2 inch cubes), fresh fenugreek (methi), salt, lemon juice, white pepper, ginger paste, garlic paste, freshly ground black peppercorns, mustard oil, cumin seeds (jeera), garlic, onions, salt, ginger , green chilles, yogurt (whisk well), black cardamom powder, cinnamon powder, coriander leaves, lemon juice, ginger",,non-veg,2,Calcium,640
336,Chicken Roulade,chicken," Chicken breasts, Olives, Jalapenos, Bell peppers(all 3), Thyme dried, White wine, Salt, Black pepper (crushed to taste), Egg, Olive oil, Mozerella cheese, Processed cheese",,non-veg,5,Calcium,585
338,Sticky Rum Chicken Wings,chicken," chicken wings without skin, hung curd, chilli powder, sweet paprika powder, english mustard paste, garlic paste, salt, garlic, rum, Bbq sauce",,non-veg,3,Iron,470
339,Dahi Lasooni Chicken,chicken," चिकन (बोनलेस क्यूब्स साइज), चीज, लहसुन, अदरक लहसुन का पेस्ट, हरा धनिया, हरी मिर्च पेस्ट, क्रीम, दही , काजू पेस्ट, नमक, काला नमक, गरम मसाला, चाट मसाला, मक्खन",,non-veg,1,Iron,360
342,Chicken Fritters,chicken," चिकन (बोनलेस और छोटे टुकड़ों में कटा हुआ), अंडे (हल्के फेंटे हुए), मैदा, लहसुन का पेस्ट, अदरक का पेस्ट, नमक , पानी, तेल ",,non-veg,4,Iron,340
343,Dragon Fire Wings,chicken," चिकन विंग्स , वेजिटेबल आॅयल, नमक और कालीमिर्च, बार्बीक्यू सॉस, हंग कर्ड, एशियन चिली पेस्ट, शहद, लहसुन की कलियां, तिल",,non-veg,3,Protien,365
344,Chicken Palwal,chicken," चिकन, प्याज, टमाटर, हरी मिर्च, जीरा पाउडर, धनिया पाउडर, हरा धनिया, दही, अदरक लहसुन, लाल मिर्च पाउडर, नमक  , तेल",,non-veg,3,Iron,290
345,Pan Seared Thigh Of Chicken,chicken," चिकन थाई, नमक, कालीमिर्च, नींबू, फ्रेश थाइम, बार्ले, ब्रॉकली, मशरूम, एक्ट्रा वर्जिन आॅलिव आॅइल, चेरी टोमैटो",,non-veg,3,Iron,245
346,Chicken In Mahalak Sauce,chicken," नमक, चीनी, सीजनिंग, तेल, कॉर्न फलोर, चिकन लेग, ताजी लाल मिर्च, लहसुन, अदरक , प्याज, लाल मिर्च पेस्ट, टोमैटो कैचअप, लाल शिमला मिर्च, पीली शिमला मिर्च, वेजिटेबल स्टॉक",,non-veg,2,Iron,280
348,Grilled Kasundi Honey Chicken With Sweet Potato Mash,chicken," चिकन ब्रेस्ट, कसुंदी (बंगाली मस्टर्ड सॉस), स्वीट पोटैटो, लाल और पीली शिमला मिर्च, ब्रॉकली, लहसुन की कलियां, रिफाइंड आॅयल, नमक, मक्खन, क्रीम, ​हरी प्याज, शहद, अदरक और लहसुन का पेस्ट",,non-veg,4,Iron,515
349,Chicken Dong Style,chicken," तेल, चिकन ब्रेस्ट, लहसुन, अदरक, टोमैटो कैचअप, ऑयस्टर सॉस, शिटाके मशरूम, बैम्ब शूट (उबले हुए), नमक, चीनी, ब्रॉथ पाउडर, शॉकिंग वाइन, पोटैटो स्टार्च , तिल का तेल, हरी प्याज",,non-veg,3,Iron,685
350,Microwave Tandoori Chicken,chicken," चिकन( टुकड़ों में कटा हुआ), लहसुन का पेस्ट, अदरक का  पेस्ट, हंग कर्ड, नमक, गरम मसाला, धनिया पाउडर, कालीमिर्च पाउडर, क्रीम , तेल , गार्निशिंग के लिए : , नींबू के टुकड़े , अनियन रिंग्स",,non-veg,4,Iron,210
351,Methi Malai Cranberry Chicken,chicken," चिकन (बड़े टुकड़ों में कटा हुआ), नमक, क्रेनबेरी प्यूरी, लाल मिर्च पाउडर, गरम मसाला, धनिया पाउडर, जीरा पाउडर, चाट मसाला, कॉर्न फ्लोर, मेथी के पत्ते, बेसन, अदरक, लहसुन, क्रीम, ग्रीक योगर्ट, मक्खन ",,non-veg,5,Iron,360
352,Southern Fried Chicken Tenders,chicken," चिकन ब्रेस्ट  (20 स्ट्रिप्स काटे, 20 ग्राम की), मैदा, नमक, ​तीखी लाल मिर्च, अंडे, ब्रेड क्रम्बस, वाइट कैबेज स्लॉ, पासर्ले की टहनी, शहद-मस्टर्ड डिप, ग्रीन बेल पैपर",,non-veg,1,Iron,625
353,Thai Style Chicken Tikka,chicken,"  चिकन थाईज़, थाई अदरक, लेमन लीव्ज़, लेमनग्रास, कोकोनट मिल्क पाउडर , रिफाइंड तेल, रेड करी पेस्ट, पीनट बटर, बैज़ल के पत्ते, लोट्स स्टेम, येलो बटर, चाट मसाला",,non-veg,4,Iron,690
354,Chicken Gilafi Kebab,chicken," चिकन कीमा, प्याज, टमाटर, हरी शिमला मिर्च, हरा धनिया, हरी मिर्च, नमक, तेल, काजू, बादाम , पुदीना, लाल मिर्च पाउडर, अदरक लहसुन का पेस्ट, जीरा पाउडर, नींबू का रस, फ्रेश क्रीम, केवड़ा वॉटर ",,non-veg,1,Phosphorus,665
356,Chicken Minced Salad,salad," जैतून का तेल, चिकन कीमा, लहसुन , प्याज, नमक, कालीमिर्च, गाजर, पत्तागोभी, हरी प्याज, स्वीट चिली सॉस, पीनट बटर, अदरक, सॉय सॉस, ताजा हरा धनिया, चिली फलेक्स, टार्ट",,non-veg,1,Fiber,405
357,Steam Bunny Chicken Bao,chicken," बन्स, मैदा, ड्राई यीस्ट, चीनी, नमक , गर्म पानी, चिकन कीमा, अंडे, सोय सॉस, चीनी, तिल का तेल, वूस्टरशर सॉस, चाइव्स, अरोमैट पाउडर",,non-veg,3,Iron,620
359,Cheese Chicken Kebabs,chicken," चिकन थाईज़, लहसुन का पेस्ट, लहसुन का पेस्ट, पीली मिर्च पाउडर, चीज़, दही, बेसन, हरी इलाइची पाउडर, पीली मिर्च पाउडर, जावित्री पाउडर, जायफल पाउडर, सेंधा नमक, हरा धनिया, तेल",,non-veg,4,Calcium,400
360,Andhra Crab Meat Masala,meat," processed crab meat, refined oil, curry leaves, garlic, green chilli, onion, ginger-garlic paste, coriander, coriander powder, cumin powder, turmeric powder, garam masala powder, Kashmiri chilli powder, salt, Lemon, chop masala, tomato",,non-veg,3,Potassium,600
361,Meat Lovers Pizza,meat," millet flour, tapioca flour, soy milk, garlic powder, baking powder, salt, tomato sauce, mozzarella cheese, prosciutto, pepperoni, chicken salami, salami milano, rosemary, olive oil",,non-veg,5,Potassium,390
362,Char Minar Biryani,meat," long grain rice, bay leaf, cardamoms pods (bruised), cloves, ghee, mint leaves, star anise, cinnamon, Water as required, Salt as per taste, mutton, Onion, Tomato, ghee, Cloves, Cardamom, Cinnamon sticks, Salt as per taste, Cloves, cinnamon stick, Cardamoms, shahi jeera, Peppercorns (roast and grind to powder), Salt as per taste, red chilli powder, coriander powder, turmeric powder, garam masala, curd, ginger paste, garlic paste, green chilli (slit and deseeded), milk, Saffron strands (add to the milk), mint, lemon juice, Salt as per taste, Browned onions, Fried garlic, saffron (soaked in milk), Coriander (chopped), ghee, fresh tomatoes, onions and garlic (caramelized)",,non-veg,3,Chloride,360
363,Cajun Spiced Turkey Wrapped With Bacon,meat," turkey breast, cajun spice, spinach leaves (cooked and drained), garlic pods, salted butter, feta cheese, bacon strips, ground black pepper, For cajun spice:, onion powder, garlic powder, seasoning salt, paprika, ground black pepper, cayenne pepper, oregano, thyme, red pepper flakes (if you like it spicy))",,non-veg,3,Vitamin_c,340
364,Lamb And Chargrilled Bell Pepper Soup,soup," lamb bones (preferably shank and shoulder), onions, celery, ginger, garlic, carrot, chargrilled red/yellow/green bell peppers (quartered), whole spices mix (black pepper, cinnamon, cardamom, clove, bay leaf), salt, water (warm), oil (sunflower or olive",,non-veg,4,Sodium,495
365,Nazaqati Boti Kebab,meat," mutton cubes (extra clean, from male goat thigh), ginger paste, raw papaya paste, white onion paste, brown onion, desi ghee, yellow chilli powder, coriander powder, salt, garam masala, potli masala, chana dal flavour, curd, rose petal paste, saffron, poppy seeds paste, cashew paste, almond paste, chiroli paste, dessicated coconut poqder, kewra, clove, green cardamom",,non-veg,4,Phosphorus,340
366,Noodle Keema Donut,meat," Noodles, Salted butter, Black pepper crush, Lamb mince, Kitchen king masala, Egg, Fillo pastry, Salted butter, Loroloso, Jalapeno, Mayonnaise",,non-veg,3,Iron,485
367,Mongolian Lamb Balls,meat," Lamb (minced), Couscous, Scallion, Garlic, Egg, Parsley, Olive oil, Mint, Ao nori herb, Salt, Five spice, Cinnamon powder",,non-veg,4,Iron,300
368,Oyster Lamb,meat," Vegetable oil, Garlic, Ginger, Lamb, Stock, Oyster sauce, Dry sherry, Sugar, Celery, Salt, Bokchoy, Shitake mushroom",,non-veg,2,Iron,300
369,Haleem Khowsuey,meat," Boneless meat (cleaned and washed), Green chillies, Ginger garlic paste, Turmeric powder, Cinnamon stick, Cloves, Green cardamom, Caraway seeds (shahi zeera), Black peppercorns, Salt, Water, Dalia (broken wheat), Mash ki dal/Urad dal, Toovar dal, Chana dal, Yellow moong dal, Rice, Salt, Water, Oil, Onions, Ginger garlic paste, Coriander leaves, Mint leaves, Green chillies (slit), Black pepper corn powder, Turmeric powder, Yogurt (beaten), Pure ghee, Coriander leaves, Mint leaves, Onions, Lemons (cut into 4 halves)",,non-veg,2,Calcium,250
370,Lauki Gosht,meat," Mutton, Lauki, Red chilli powder, Turmeric powder, Coriander powder, Garlic paste, Ginger paste, Fresh coriander leaves, Green chillies, Tomatoes, Onion, Cinnamon stick, Salt, Oil, OIl",,non-veg,1,Iron,390
371,Railway Mutton Curry,meat," Mutton, Tomato, Onion, Yogurt (plain), Refine oil, Whole cumin, Bay leaf, Cardamom seeds, Cinnamon, Black cardamom, Black pepper, Salt, Magic spice (blend of all spices), Green chillies, Turmeric, Ginger and garlic paste, Coriander leaf",,non-veg,3,Calcium,425
372,Tricolor Dimsums,meat," thigh minced chicken, green chilli, fresh coriander, oyster sauce, sesame oil, salt, broth powder, white pepper powder",,non-veg,4,Iron,685
374,Chicken Shami Kebab,meat," Oil, Cumin Seeds, Cloves, Black Peppercorns, Cinnamon, Coriander Seeds, Ajwain, Red Chilli Whole, Chilli Flakes, Boneless Chicken, Salt, Water, Ginger, Green Chilli, Garlic, Coriander Leaves , Mint Leaves , Egg",,non-veg,5,Phosphorus,670
375,Mutton Shami Kebab,meat," Mutton Keema, Chana Dal, Ghee, Cinnamon Stick, Mace , Cloves, Bay Leaf , Green Cardamoms, Black Peppercorns, Brown Cardamom, Salt, Red Chilli Powder, Water, Onion, Green Chilli , Lemon",,non-veg,4,Phosphorus,625
376,Mutton Beliram,meat," Mutton, Desi Ghee, Coriander Seeds, Curd, Onion, Ginger, Garlic, Red Chilli Powder, Cloves, Green Cardamom, Black Peppercorn, Cinnamon, Salt, Fresh Coriander",,non-veg,3,Iron,220
377,Keema Matar Masala,meat," Ground meat: Chicken/Mutton/Turkey or Lamb, Red onion paste, Ginger-garlic paste, Onion powder, Lime juice (freshly squeezed), Red chili powder, Dry red chilis, Roma Tomatoes (diced), Spice mix of Turmeric, Red Chili Powder, Coriander powder, Cumin Powder, salt and Garam Masala. (1 tsp of each made into a paste with water), Cilantro, Mustard oil to cook, Salt, Sugar, Green peas, Hot water",,non-veg,2,Vitamin_c,465
380,Lagan Ka Gosht,meat," Lamb Leg (Boneless, cut into 2 inch cubes), Ginger Paste, Red Chilli Powder, Yoghurt (Whisk well) , Salt, Clarified Butter (Desi Ghee)	, Onions, Gram Flour, Green Cardamom Powder, Cumin Seed Powder	, Black Pepper Powder (Kaalimirch), Clove Powder (Lavang), Nutmeg (Jaiphal), Mint Leaves, Fresh Coriander Leaves, Lemon Juice, Ginger",,non-veg,4,Iron,450
381,Rampuri Korma,meat," Lamb Shoulder (Boneless, cut into 2 inch cubes), Clarified Butter (Desi Ghee), Green Cardamom, Cinnamon, Cloves, Onions (Thin Slice), Garlic Paste,  Ginger Paste	, Salt , Coriander Seed Powder, Yoghurt (Whisk well), Red Chilli Powder, Roasted Cashew, Green Cardamom Powder (Chotti Elaichi), Black Pepper Powder, Mace Powder (Javitri), Rose Water (Gulaabjal),  Saffron",,non-veg,5,Chloride,365
382,Dhaba Raan,meat," Mutton leg, Ginger garlic paste, Nutmeg powder, Red chili powder, Salt, Refined oil, Green Cardamoms, Black Cardamoms, Mace, Brown Onion paste, Curd, Javitri Elaichi Powder, Black pepper powder, Garam Masala Powder",,non-veg,5,Iron,220
383,Balti Meat,meat," Refined oil, Black cardamoms, Green cardamoms, Mace, Clove, Cinnamon stick, Black pepper corn, Ginger garlic paste, Ginger, Green chilies, Mutton curry cut, Brown onion paste, Salt, Kashmiri red chili powder, Tomato Puree, Garam masala powder, Coriander powder, Cumin powder",,non-veg,3,Potassium,305
384,Coffee Marinated Mutton Chops,coffee," mutton chops, espresso, honey, balsamic Vinegar, rosemary, pink peppercorns (crushed), olive oil, salt",,non-veg,2,Chloride,210
385,Tawa Mutton,meat," Mutton Chunks boneless, Ginger garlic paste, Brown onion paste, Oil,  Salt, Desi ghee, onion, garlic,  ginger,  green chilies,  tomatoes, Kashmiri Chili powder, Coriander powder,  Cumin powder,  Black pepper powder,  Garam Masala Powder,  Coriander",,non-veg,4,Iron,590
386,Tandoori Malai Bater (Quail),meat," whole bater. approx. 100 - 110 gms each,  lemons , Salt,  Ginger Paste,  Garlic Paste, Green Chili Paste,  Hung curd,  Javitri Powder,  White Pepper Powder,  Green cardamom,  Cashew nut Paste,  Processed cheese(Grated Parmesan Cheese), Fresh Cream, refined oil,  Chaat Masala",,non-veg,5,Iron,335
395,Sali Boti (Parsi Meat Dish),meat," Mutton (wash and cut into very small cubes), Ghee or oil, Tomatoes, Onions, Green chillies, Coriander leaves, Chilli powder, Turmeric powder, Ginger-garlic paste, Water, Vinegar, Jaggery, Salt, Potatoes, Oil ",,non-veg,5,Potassium,500
396,Bhuni Raan,meat," Mutton leg, Oil, Salt, Malt vinegar, Ginger piece (ground into paste), Garlic cloves (ground into paste), Cumin powder, Coriander powder, Garam masala, Red chilli powder, Yogurt",,non-veg,3,Calcium,230
408,Paya Curry,meat," Sheep's trotters, Rice flour, Lemon juice, Ghee, Cumin seeds, Onions, Ginger paste, Garlic paste, Tomatoes, Green chilli, Chilli powder, Turmeric powder, Garam masala, Salt",,non-veg,5,Chloride,305
411,Nadru Shammi Kebab,meat," कमल ककड़ी, चना दाल, चाट मसाला, ताजा धनिया, गरम मसाला, हरी मिर्च, प्याज, लाल मिर्च पाउडर, चना दाल पाउडर, नमक, तेल",,non-veg,3,Phosphorus,285
412,Mutton Pepper Fry,meat," लैंब करी कट, पैपर पाउडर, रिफाइंड तेल, सौंफ पाउडर, गरम मसाला, तेजपत्ता, कढ़ीपत्ता, प्याज, टमाटर, घी, नमक, लाल मिर्च पाउडर, हल्दी पाउडर, अदरक-लहसुन का पेस्ट, हरा धनिया",,non-veg,5,Protien,660
413,Mutton Rada,meat," सरसों का तेल, प्याज , अदरक लहसुन पेस्ट, टमाटर, मटन (मीडियम टुकड़ों में कटा हुआ), नमक, हल्दी, चिली पाउडर, गरम मसाला",,non-veg,4,Protien,425
414,Nihari Mutton,meat," मटन लेग्स, तेल, प्याज , अदरक, हल्दी, धनिया पाउडर, लाल मिर्च पाउडर, दालचीनी पाउडर, नमक, लौंग, बड़ी इलाइली, मैरो बोन, नींबू का रस, हरा धनिया, पुदीने के पत्ते",,non-veg,5,Protien,665
415,Mutton Kadai,meat," मटन के टुकड़े (धोकर सूखा लें), अदरक का पेस्ट, लहसुन का पेस्ट, प्याज का पेस्ट, तेल, जीरा, गरम मसाला, नमक, हल्दी पाउडर, धनिया पाउडर, टमाटर ",,non-veg,1,Protien,280
416,Tawa Mutton,meat," मटन चंक्स बोनलेस, अदरक लहसुन का पेस्ट, ब्राउन प्याज पेस्ट, तेल, नमक, देसी घी, प्याज, लहसुन, अदरक, हरी मिर्च, टमाटर, कशमिरी लाल मिर्च, धनिया पाउडर, जीरा पाउडर, कालीमिर्च पाउडर, गरम मसाला पाउडर, हरा धनिया",,non-veg,2,Protien,220
417,Mutton Beliram,meat," मटन, देसी घी, साबुत धनिया, दही, प्याज, अदरक, लहसुन, लाल मिर्च पाउडर, लौंग, हरी इलाइची, दालचीनी स्टिक, नमक, ताजा हरा धनिया",,non-veg,2,Protien,490
418,Bamboo Biryani,meat," चिकन, नमक, कालीमिर्च पाउडर, हल्दी पाउडर, लाल मिर्च पाउडर, धनिया पाउडर, जीरा, बिरयानी मसाला, अदरक , लहसुन की कलियां, हरा धनिया , पुदीने के पत्ते, दही, बासमती चावल, घी/तेल, साबुत मसाले, केसर का पानी, प्याज ",,non-veg,2,Carbohydrates,225
419,Awadhi Gosht Korma,meat," मटन, रिफाइंड तेल, हरी इलाइची, साबुत दालचीनी, बड़ी इलाइची, तेजपत्ता, हल्दी पाउडर, पानी, अदरक-लहसुन का पेस्ट, धनिया पाउडर, लाल मिर्च पाउडर, लहसुन (कुटा हुआ), प्याज, दही, गुलाब जल, गरम मसाला, जायफल-धनिया पाउडर, केसर, नमक, इत्र, आटा , हरा धनिया, अदरक  ",,non-veg,4,Protien,630
420,Braised Lamb Shanks,meat," लैंग शैंक्स, जैतून का तेल, प्याज, गाजर, सेलेरी स्टिक, लहसुन, व्हाइट वाइन, लैंब स्टॉक, व्हाइट वाइन, रोजमेरी, टोमैटा प्यूरी",,non-veg,5,Iron,325
421,Mutton Kathi Roll,meat," मटन (बोनलेस), अदरक लहसुन पेस्ट, नमक, हल्दी पाउडर, लाल मिर्च पाउडर, धनिया पाउडर, जीरा पाउडर, हरी मिर्च, तेल, पानी, चपाती , अंडे , प्याज , हरा धनिया, चाट मसाला",,non-veg,4,Protien,480
424,Meat Lovers Pizza,meat," बाजरे का आटा, साबूदाने का आटा, सोया मिल्क, लहसुन पाउडर, बेकिंग पाउडर, नमक, टोमैटो सॉस, मॉजरेला चीज, प्रॉस्क्रीटो, पैपररॉनी, चिकन सलामी, सलामी मिलानो, रोजमैरी, जैतून का तेल",,non-veg,2,Potassium,630
425,Hokh Hund Mutton Kofte,meat," उबालकर धूप में सूखे पत्ते , लैंब बॉल्स (उबली हुई और डीप फ्राई), प्याज, लहसुन, हरी इलाइची, बड़ी इलाइची, कसूरी मेथी, देगी मिर्च, सौंफ पाउडर, धनिया पाउडर, हल्दी पाउडर, नमक, सरसों का तेल, देसी घी",,non-veg,5,Protien,335
427,Bengali Lamb Curry,meat," लैंब के पीस, दही, हल्दी पाउडर, कैस्टर शुगर, लाल मिर्च पाउडर, सरसों का तेल, प्याज, अदरक पेस्ट, लहसुन पेस्ट, हरी मिर्च, सरसों के दाने, बादाम ",,non-veg,2,Iron,355
429,Mutton Ghee Roast,meat," घी, मटन, प्याज, नमक, हल्दी पाउडर, अदरक पेस्ट, लहसुन पेस्ट, लाल मिर्च पाउडर, जीरा, साबुत धनिया, सरसों के दाने, सौंफ, लौंग , दालचीनी स्टिक, तेजपत्ता, कशमिरी मिर्च, कालीमिर्च ",,non-veg,2,Protien,680
430,Peshawari Chapli Kebab,meat," मटन , प्याज , टमाटर  , टमाटर के स्लाइस, कालीमिर्च, साबुत धनिया, नमक, तेल ",,non-veg,3,Phosphorus,595
432,Andhra Pan Fried Pomfret,curry," white pomfret fish, sunflower refined ooil, red chilli powder, salt, turmeric powder, ginger-garlic paste, Lemon (juiced), cumin powder, coriander powder, garam masala, Green chilli, curry leaves, coriander",seafood,veg,5,Iron,250
433,Malabari Fish Curry,curry," sear fish, coconut, ginger, pureed tamarind, salt, powdered turmeric, green chillies, red chilli powder, shallots",seafood,non-veg,5,Vitamin_A,620
434,Korean Bibimbap,chilli," carrot, yellow and green zucchini, bell pepper, pok choy, spinach, chicken, prawns, jasmine rice, soya sauce, sesame oil, pepper, salt, garlic, ginger, egg, For Gochujang Sauce:, gochujang paste, garlic , chilli paste, sugar",seafood,veg,4,Iron,500
435,Ca Cang Kho,soya," dice onion, minced garlic, fresh coriander, spring onion, sole fish slice, dark soya sauce, black pepper (crushed), oyster sauce, oil, tempura flour",seafood,veg,1,Vitamin_A,655
437,Portugese Fish Stew,fish," sole fillet (you can also do 2/3 types of fish), large shrimps (optional), potatoes (peeled), onions (cut into slices), garlic cloves, red capsicum (can use green also), parsley or coriander (choose the herb that most suits your taste buds), Few dashes of hot sauce, paprika, olive oil, white wine, rock salt",seafood,non-veg,3,Vitamin_A,480
438,Tulsi Ajwain Ka Mahi Tikka,tikka," river sole fish, basil paste, ajwain, ginger and garlic paste, green chilli paste, garam masala powder, cardamom powder, hung curd, dairy cream, salt, mustard oil, kasuri methi, lemon juice",seafood,veg,1,Iodine,545
439,Malabar Fish Curry,curry," Whole coriander seeds, Whole red chilli, Coconut oil, Mustard seeds, Onion, Curry leaf, Coconut milk, Tamarind pulp, Coriander, Seabass fish curry cuts",seafood,non-veg,1,Vitamin_A,670
440,Surmai Curry With Lobster Butter Rice,rice," Tamarind, Red chilli powder, Turmeric powder, Salt, Fresh coconut, Onion, Garlic cloves, Coriander seeds, Fenugreek seeds, Red chilli powder, Turmeric powder, Tamarind (lemon sized), Butter, Lobster (de-shell and devein and make a small cube), Salt and lime, Surmai",seafood,veg,5,Chloride,385
441,Seared Salmon In Tabasco Butter,butter," Butter, Tabasco, Chives, Salt, Salmon fillet, Olive oil, Sea salt",seafood,non-veg,1,Calcium,570
