,Name,catagory,description,sub_catagory,Veg_Non,Review,Nutrient,Price
734,Ajwaini Paneer Kofta Curry,paneer," cottage cheese, singhare ka atta (water chestnut flour), sendha namak, fresh tomato puree, ajwain (caraway seed), deggi mirch, coriander, oil",dinner,veg,5,Phosphorus,520
735,Carrot Cake,cake," carrot, flour, castor sugar, Egg, oil, baking soda, baking powder, salt, walnut, cinnamon",dinner,veg,3,Potassium,345
737,Seviyan Kheer,kheer," vermicelli, pure ghee, milk, grain sugar, green cardamom, cloves, whole almonds, sultanas / kishmish, fresh rose petals",dinner,veg,4,Iron,650
738,Thandai Rasmalai,thandai," milk, water, sugar, saunf, cardamom powder, almond, pistachio, watermelon seed (skinned), poppy seeds, rose water, peppercorn whole, dried or fresh rose petals, milk, refined flour, grain sugar, white vinegar (to curdle the milk), water",dinner,veg,3,Iron,595
739,Badam Aur Gulkand Ki Kulfi,kulfi," almonds whole, gulab ki patti, full fat milk, mawa (unsweetened), sugar, Few strands of saffron",dinner,veg,5,Calcium,530
740,Almond &amp; White Chocolate Gujiya,gujiya," all-purpose flour, clarified butter (ghee), water, white chocolate, dessicated coconut, green cardamom powder, almond, jaggery",dinner,veg,2,Magnesium,365
741,Stuffed Eggplant With Schezwan Sauce,sauce," mixed vegetables, eggplant, cottage cheese, cornflour, oil, ginger, celery, onion, garlic, red chilli, tomato, oyster sauce, rice wine, vinegar, salt, castor sugar, white pepper, sesame oil, corn flour, sichuan pepper, stock water",dinner,veg,2,Protien,235
742,Ruwangan Hachi Chaman,cheese," cottage cheese (deep fried), tomatoes (boiled and sun dried), onion, garlic, green cardamom, black cardamom, cinnamon sticks, bay leaves, turmeric, red mirch powder, saunf powder, dry ginger powder, coriander powder, salt, mustard oil, desi ghee",dinner,veg,4,Vitamin_c,405
743,Hokh Hund Mutton Kofte,mutton," boiled sun dried leaves, lamb balls (boiled and deep fried), sliced onion , garlic, green cardamom, black cardamom, kasturi methi, deggi mirch, saunf powder, coriander powder, turmeric powder, salt, mustard oil, desi ghee",dinner,non-veg,3,Iron,520
744,Al Hachi Chicken,chicken," shallow fried chicken, bottle gourd (boiled and sun dried), onion, garlic, Whole spices:, green cardamom, black cardamom, cinnamon sticks, turmeric, deggi mirch, fennel seeds powder, dry ginger powder, coriander powder, salt, mustard oil, desi ghee",dinner,non-veg,3,Magnesium,360
745,Almond And Chicken Momos (without Shell),chicken," chicken mince, garlic, carrots, spring onion, ginger, soya sauce, oyster sauce, sesame oil, pepper powder, egg, almonds (blanched), oil (for greasing)",dinner,non-veg,1,Calcium,240
746,Rose Berry Valentine Forest,berry," butter, sugar, egg white, flour, rose petal powder, For Berry Baked Yogurt:, yogurt, double cream, condensed milk, berry puree, fresh berry slice, vanilla pod, For Raspberry Foam:, raspberry puree, water, sugar, lecithin, For Vanilla Marshmallow:, confectioners sugar (powdered sugar), water, silver gelatine sheet, vanilla pod, For Crunchy Chocolate Pudding:, milk chocolate, cocoa butter, almond crunch",dinner,veg,2,Vitamin_A,660
747,Berry Parfait Hazelnut White Chocolate Sable,chocolate," For berry parfait:, egg yolk, caster sugar, berry puree, cream cheese, double cream, For Hazelnut Streusel:, ground hazelnut, flour, caster sugar, butter, For Hazelnut White Chocolate Pressed Sable:, hazelnut streusel, cocoa butter, puffed rice, clarified butter, melted white chocolate, For Flexy Berry:, raspberry puree, sugar, liquid glucose, pectin",dinner,veg,4,Vitamin_A,535
748,Hariyali Biryani Risotto,risotto," olive oil, butter, onion, celery, leeks, chilly flakes, green peas, broccoli, beans, mint coriander pesto, risotto, cream, salt, pepper, mint",dinner,veg,4,Iron,540
749,Dum Biryani Risotto,risotto," olive oil, butter, garlic , onion, celery, leeks, biryani masala, tandoori chicken, makhani gravy, coriander, mint, risotto, cream, salt, pepper, For garnishing:, fried onion, lemon wedges",dinner,veg,5,Carbohydrates,460
751,Handi Paneer,paneer," paneer, ginger, turmeric powder, chilli powder, garam masala powder, tomato, water, coriander leaves, powdered black pepper, refined oil, onion, beaten curd",dinner,veg,1,Phosphorus,605
752,Stuffed Ravioli,stuffed," pumpkin, shallots, garlic cloves, olive oil, salt, pepper, walnut, parmesan cheese, A sprig of oregano, all purpose flour, egg yolk, whole egg, olive oil, salt",dinner,veg,1,Vitamin_A,555
753,Marchwangan Korma,korma," meat (cut into pieces), water, pure ghee, salt, ground garlic, green cardamoms, cloves, kashmiri red chilli powder (dissolved in 10 cups of water), Black cardamoms, turmeric powder, Cinnamon sticks, dry ginger powder, dry cockscomb (mawal) flowers (heated with 1 1/2 cups water, extract), black cumin seeds, dry mint leaves",dinner,veg,1,Potassium,405
754,Chemmeen Moru Curry,curry," fish (mackerel), curd, onion, green chilli, curry leaves, coconut, cumin seeds, fennel seeds, red chilli powder, turmeric powder, A small piece of ginger, oil, onion, Curry leaves",dinner,veg,2,Vitamin_A,270
755,Char Minar Biryani,biryani," long grain rice, bay leaf, cardamoms pods (bruised), cloves, ghee, mint leaves, star anise, cinnamon, Water as required, Salt as per taste, mutton, Onion, Tomato, ghee, Cloves, Cardamom, Cinnamon sticks, Salt as per taste, Cloves, cinnamon stick, Cardamoms, shahi jeera, Peppercorns (roast and grind to powder), Salt as per taste, red chilli powder, coriander powder, turmeric powder, garam masala, curd, ginger paste, garlic paste, green chilli (slit and deseeded), milk, Saffron strands (add to the milk), mint, lemon juice, Salt as per taste, Browned onions, Fried garlic, saffron (soaked in milk), Coriander (chopped), ghee, fresh tomatoes, onions and garlic (caramelized)",dinner,veg,3,Chloride,200
756,Apricot And Cardamom Dome,dome," For dome:, white chocolate, orange edible colour, green edible colour, For mousse:, whipped cream, apricots puree, vanilla, For ganache:, white chocolate, fresh cream, cardamom powder",dinner,veg,2,Iron,435
757,Tiranga Lasagna,tiranga," lasagna sheets, fresh spring tomato, spinach, onion, garlic, white sauce, tomato sauce, parmesan or mozzarella cheese, salt and pepper, Oven proof glass bowl 3 inch width-5 inch height",dinner,veg,4,Chloride,615
759,Korean Bibimbap,chilli," carrot, yellow and green zucchini, bell pepper, pok choy, spinach, chicken, prawns, jasmine rice, soya sauce, sesame oil, pepper, salt, garlic, ginger, egg, For Gochujang Sauce:, gochujang paste, garlic , chilli paste, sugar",dinner,veg,5,Iron,415
761,Rainbow Sangria,sangria," white wine, black grapes, strawberry, pineapple, orange (skinned), green apple",dinner,veg,5,Iron,410
763,Devils Love Bite,love," strawberries (pureed), white rum, sugar syrup, lemon (juiced)",dinner,veg,4,Vitamin_c,400
764,Boozy Snake,tomato," vodka , tomato (juiced), black pepper, salt, lemon (juiced), tabasco",dinner,non-veg,4,Protien,630
765,Ca Cang Kho,soya," dice onion, minced garlic, fresh coriander, spring onion, sole fish slice, dark soya sauce, black pepper (crushed), oyster sauce, oil, tempura flour",dinner,veg,3,Vitamin_A,615
768,Christmas Tree Pizza,pizza," pizza dough (2 boules), red pepper, red onion, basil pesto (purchased, homemade or vegan pesto), mozzarella cheese, Kosher salt",dinner,veg,3,Chloride,530
769,Portugese Fish Stew,fish," sole fillet (you can also do 2/3 types of fish), large shrimps (optional), potatoes (peeled), onions (cut into slices), garlic cloves, red capsicum (can use green also), parsley or coriander (choose the herb that most suits your taste buds), Few dashes of hot sauce, paprika, olive oil, white wine, rock salt",dinner,non-veg,5,Vitamin_A,360
770,Cajun Spiced Turkey Wrapped With Bacon,wrapped," turkey breast, cajun spice, spinach leaves (cooked and drained), garlic pods, salted butter, feta cheese, bacon strips, ground black pepper, For cajun spice:, onion powder, garlic powder, seasoning salt, paprika, ground black pepper, cayenne pepper, oregano, thyme, red pepper flakes (if you like it spicy))",dinner,non-veg,5,Vitamin_c,405
774,Badam Papite Ke Kebab With Pineapple Salsa,kebab," ​कच्चा पपीता, कच्चा आलू, बादाम, नमक, हींग, हल्दी, अजवाइन, धनिया, अदरक, हरी मिर्च, बेसन, हरा धनिया, तेल, पाइनएप्पल, प्याज, हरी मिर्च, हरा धनिया, नींबू का रस, नमक , कालीमिर्च",dinner,non-veg,4,Phosphorus,220
775,Mixed Vegetable Soup,soup," मिक्स वेजिटेबल  (टमाटर, गाजर, मटर और फ्रेंच बीन्स), नमक, जीरा पाउडर, तेल, कढ़ीपत्ता ",dinner,veg,2,Sodium,595
779,Pan Seared Thigh Of Chicken,chicken," चिकन थाई, नमक, कालीमिर्च, नींबू, फ्रेश थाइम, बार्ले, ब्रॉकली, मशरूम, एक्ट्रा वर्जिन आॅलिव आॅइल, चेरी टोमैटो",dinner,non-veg,3,Iron,350
784,Babaganoush Margarita,margarita," टकिला, स्मोक्ड बाबागनोश मिक्स, नींबू का रस, आइस",dinner,veg,5,Vitamin_c,390
785,Monks Cappuccino,cappuccino," 2 बार स्पून कॉफी, चीनी, ओल्ड मॉन्क, कल्हुआ",dinner,veg,2,Calcium,480
788,Khoya Paneer,paneer," काजू, पनीर, देसी घी, खोया , दही, अदरक, हरी इलाइची, हरी मिर्च, नमक, हरा धनिया ",dinner,veg,3,Phosphorus,250
789,Chicken In Mahalak Sauce,sauce," नमक, चीनी, सीजनिंग, तेल, कॉर्न फलोर, चिकन लेग, ताजी लाल मिर्च, लहसुन, अदरक , प्याज, लाल मिर्च पेस्ट, टोमैटो कैचअप, लाल शिमला मिर्च, पीली शिमला मिर्च, वेजिटेबल स्टॉक",dinner,non-veg,5,Iron,570
790,Mutton Rada,mutton," सरसों का तेल, प्याज , अदरक लहसुन पेस्ट, टमाटर, मटन (मीडियम टुकड़ों में कटा हुआ), नमक, हल्दी, चिली पाउडर, गरम मसाला",dinner,non-veg,2,Protien,340
791,Nihari Mutton,mutton," मटन लेग्स, तेल, प्याज , अदरक, हल्दी, धनिया पाउडर, लाल मिर्च पाउडर, दालचीनी पाउडर, नमक, लौंग, बड़ी इलाइली, मैरो बोन, नींबू का रस, हरा धनिया, पुदीने के पत्ते",dinner,non-veg,1,Protien,310
793,Berry Parfait Hazelnut White Chocolate Sable,chocolate," For berry parfait:, egg yolk, caster sugar, berry puree, cream cheese, double cream, For Hazelnut Streusel:, ground hazelnut, flour, caster sugar, butter, For Hazelnut White Chocolate Pressed Sable:, hazelnut streusel, cocoa butter, puffed rice, clarified butter, melted white chocolate, For Flexy Berry:, raspberry puree, sugar, liquid glucose, pectin",christmas,veg,3,Vitamin_A,590
794,Belgian Pork Chop,chop," pork chop, pink pepper corn, green pepper corn, aromatic sauce, salt, black pepper, salted butter, refined oil, red cabbage, bell pepper chop, apricot, onion, red wine, ancho chilli, cayenne pepper, microgreen",christmas,veg,1,Iron,390
796,Valentine Strawberry Mousse,strawberry," Milk, Butter, Egg yolk, Gelatine, Strawberry puree, Double cream, Sugar",christmas,veg,3,Vitamin_A,530
797,Strawberry &amp; Pistachio Breton Tart,strawberry," Plain flour, Baking powder, Sea salt, Unsalted butter, Egg yoks, Castor sugar, Double cream, Yolk, Sugar, Gelatine, Butter, Pistachio paste, Strawberry",christmas,veg,4,Vitamin_A,550
798,Love Bite,love," Vodka, Strawberry syrup, Pineapple juice, Egg white, Fresh strawberries",christmas,veg,1,Vitamin_c,480
799,Honey Sage Gin Fizz,honey," Gin, Honey sage syrup, Fresh lime juice, Soda, Green sage leaves (soaked), Honey, Water, Sage leaves (fresh)",christmas,veg,5,Iron,485
801,Duo Of Chocolate And Strawberry,strawberry," Dark chocolate, White chocolate, Strawberries",christmas,veg,4,Vitamin_c,465
805,Mustard-Parmesan Whole Roasted Cauliflower,roasted," Cauliflowers, Garlic, Halved, Olive Oil , Dijon mustard , Kosher salt , Freshly Ground Black Pepper , Fresh Parsley Leaves, Parmesan , Lemon wedges",christmas,veg,5,Chloride,345
806,Hassel Back Sweet Potatoes,vanilla," sweet potatoes, butter, brown sugar, pure vanilla extract, ground cinnamon, himalayan pink salt / rock salt",christmas,veg,5,Chloride,485
807,Slow Cooked Spiced Sangria,sangria," red wine (merlot / zinfandel), apple cider, honey, Orange (zested and juiced), Cloves (whole), Green Cardamom, Cinnamon Sticks, Anise (whole), brandy",christmas,veg,4,Iron,585
808,Mother Christmas Cake,cake," Tart Apples (2 large), Sugar, Apple juice, Eggs, Vegetable oil, Vanilla extracts, All-purpose flour, Apple pie spice (cinnamon), Salt, Pecans, Candied red cherries (halved), Candied green cherried (halved), Candied pineapple (diced), Cashews (optional)",christmas,veg,4,Potassium,660
809,Mocha Cashew Butter,butter," Cashews, Butter (softened), Chocolate chips (semi sweet), Instant coffee granules, Water",christmas,veg,1,Magnesium,555
810,Matcha Tea Macarons,tea," Egg whites, breakfast sugar, icing sugar, almond powder, matcha powder, heavy cream, white chocolate",christmas,veg,5,Vitamin_A,505
811,"Amaranthus Granola With Lemon Yogurt, Berries And Marigold",yogurt," Popped Amaranthus (cholai), Oats, Almonds, Cinnamon Powder, Sunflower Seeds, Sesame Seeds, Honey, Brown Sugar, Salt, Olive Oil, Lemon rind, Plain Yogurt (whipped with lemon rind), Blueberries",christmas,veg,4,Calcium,300
813,Chocolate Fudge Cookies,cookie," Dark Chocolate Coverture, Butter, Sugar, Eggs, Flour, Baking Powder, Salt, Cocoa Powder, Vanilla Essence",christmas,veg,1,Magnesium,600
815,Veg Summer Rolls,rice," Rice paper sheets, iceberg Lettuce, carrot, bean sprouts, cucumber, tofu, basil, mint leaves, coriander, rice noodles (soaked in warm water for 20-25 minutes), peanuts, hoisin sauce, peanuts, garlic, oil, red chillies, water",christmas,veg,4,Carbohydrates,250
816,Summer Breeze,fresh," vodka, Fresh Litchi, lemon Juice, Black lava salt (to rim the glass)",christmas,veg,5,Chloride,645
818,Bourbon Fig,bourbon," Bourbon, Fresh Fig, Angustora Bitters, Egg White (optional)",christmas,veg,2,Vitamin_A,265
819,Khas Khas Ka Halwa,halwa," Poppy Seeds, Sugar, Milk, Desi Ghee, Green Cardamom, Almonds, Water, Sugar, Pistachios, Water, Sugar",christmas,veg,5,Iron,565
821,Eggless Vanilla Cake,cake," Maida, Baking Powder, Castor Sugar, Butter, Milk, Vanilla Essence, Vinegar",christmas,veg,5,Potassium,465
822,Dinner Roll,egg," Yeast, Sugar, Lukewarm Water, Flour, Salt, Oil, Egg Yolk, Milk, Butter, Oil, Egg White",christmas,veg,1,Vitamin_A,655
823,Aata Walnut Cookies,cookie," Butter, Castor Sugar, Aata, Baking Powder, Coffee Powder, Walnuts",christmas,veg,1,Manganese,250
825,Sweet Potato Pie,pie," Yams (red skinned), Condensed Milk, Sugar, Egg , Cinnamon , Marshmallows , ",christmas,veg,2,Vitamin_A,555
826,Wok Tossed Asparagus In Mild Garlic Sauce,sauce," Asparagus, 1 fried onion (medium), 1/2 tsp breakfast sugar, 10 ml potato starch, 20 ml stock vegetarian, 20 gm porcini, Salt to taste, 50 ml oil",christmas,veg,3,Chloride,585
829,Cinnamon Oatmeal Pancakes,pancakes," rolled oats, buttermilk (divided), whole wheat flour or oat flour, baking powder, baking soda, cinnamon, salt, eggs, canola oil , honey or maple syrup, ",christmas,veg,2,Selenium,210
834,Chocolate Chip Cheesecake,chocolate," Butter biscuits (broken into pieces), Butter (softened), Cream cheese (softened), Sugar, Egg, Rose essence or Vanilla essence, Chocolate chips",christmas,veg,3,Calcium,475
836,Chocolate Lava Cake,cake," Dark chocolate, Butter, Icing sugar, Egg yolks +  whole eggs, Flour",christmas,veg,2,Vitamin_A,285
837,Eggless Coffee Cupcakes,coffee," Maida/ flour, Baking powder, Sugar, Cocoa powder, Vanilla essence, Butter (softened, salted. In case you are using unsalted butter, add 1/4 tsp salt), Milk (to make the batter smooth. Adjust the milk quantity according to your batter's smoothness), Coffee powder + 1 tsp water, to make a paste (You can increase or decrease according to your coffee tolerance)",christmas,veg,5,Vitamin_D,570
838,Chicken In White Wine,wine," black pepper, plain flour, olive or sunflower oil, rashers lean bacon, onions or shallots  (cut in half), mushrooms, butter, boneless and skinless chicken breasts (chopped into 3cm pieces), dry white wine, Chicken or vegetable stock, garlic cloves, Bay leaves, Fresh thyme sprigs (washed or 1/2 tsp dried thyme)",christmas,non-veg,1,Iron,330
844,Chocolate And Almond Rum Ball H,almond," चॉकलेट स्पॉज एगलेस, डार्क चॉकलेट, सिंगल क्रीम, बादाम, कैस्टर शुगर, इंस्टेंट कॉफी पाउडर, डार्क रम",christmas,veg,1,Magnesium,380
846,Apple And Walnut Cake,cake," सेब, अंडे, अखरोट, चीनी, अखरोट, तेल, मैदा, बेकिंग पाउडर, दालचीनी पाउडर",christmas,veg,2,Potassium,265
848,Chocolate Nero Cookies,cookie," बादाम, अंडे, चीनी (पीसी हुई), चॉकलेट (हल्की मीठी), मक्खन, मैदा, बेकिंग पाउडर, कैस्टर शुगर, आइसिंग शुगर",christmas,veg,5,Magnesium,310
849,Gluten Free Almond Cake,cake," बादाम पाउडर, अंडा, शहद , बेकिंग सोडा, वनिला एसेंस, नमक, शहद, बादाम",christmas,veg,2,Potassium,435
850,Christmas Cookie,cookie," बटर, कैस्टर शुगर, अंडे, सोक्ड फ्रूट्स, मैदा, वनीला एसेंस, बेकिंग सोडा",christmas,veg,2,Protien,235
851,Cinnamon Star Cookies,cookie," मक्खन, कैस्टर शुगर, क्रिसमस मिक्स स्पाइसी, दालचीनी पाउडर, शहद, ग्लूकोज, क्रीम, कुट्टू का आटा, बेकिंग सोडा, ब्रेड फलार",christmas,veg,2,Protien,535
852,Ginger Cookies,cookie," मक्खन, कैस्टर शुगर, बेकिंग पाउडर, बेकिंग सोडा, शहद, मैदा, अदरक",christmas,veg,3,Protien,365
853,Christmas Chocolate Fudge Cookies,cookie," मक्खन, ब्राउन शुगर, चॉकलेट, चॉकलेट चिप्स, अंडे , आटा, कोको पाउडर, बेकिंग पाउडर",christmas,veg,5,Magnesium,525
854,Gluten-free Christmas Cake,cake," क्रिसमस ड्राई फ्रूट्स (पहले से भीगे हुए),  संतरे का छिलका, नींबू का छिलका, गुड़ का सिरप, बादाम का आटा, सेब, मक्खन, अंडे ",christmas,veg,5,Potassium,675
857,Microwave Cookies,cookie," आटा, अंडे, मक्खन, चीनी , वनीला एसेंस, माइक्रोवेव",christmas,veg,3,Protien,215
858,Whole Wheat Cake,cake," ओवन तापमान , गेंहू का आटा, गुड़ की शक्कर, बेकिंग पाउडर, तेल, अंडे, पानी, बादाम एसेंस, अखरोट",christmas,veg,5,Potassium,555
859,Plum Cake,cake," ओवन तापमान:, बटर, चीनी, अंडे, बादाम, वनीला एसेंस, मिक्स ड्राई फ्रूट , आटा , ",christmas,veg,5,Potassium,545
860,Double Chocolate Easter Cookies,cookie," मक्खन, ब्राउन शुगर, कैस्टर शुगर, वनिला एसेंस, डार्क चॉकलेट, रिफाइंड फ्लॉर, कोको पाउडर, बेकिंग सोडा, नमक, दूध, कैडबरी जेम्स",christmas,veg,1,Magnesium,220
864,Rasmalai Tiramisu,rasmalai," Rasmalai, instant coffee powder, mascarpone cheese, Whipped cream, Eggless sponge cake (eight inch), Icing sugar, Cocoa powder, water",diwali,veg,3,Potassium,475
865,Seviyan Kheer,kheer," vermicelli, pure ghee, milk, grain sugar, green cardamom, cloves, whole almonds, sultanas / kishmish, fresh rose petals",diwali,veg,5,Iron,235
866,Thandai Rasmalai,thandai," milk, water, sugar, saunf, cardamom powder, almond, pistachio, watermelon seed (skinned), poppy seeds, rose water, peppercorn whole, dried or fresh rose petals, milk, refined flour, grain sugar, white vinegar (to curdle the milk), water",diwali,veg,3,Iron,455
867,Badam Aur Gulkand Ki Kulfi,kulfi," almonds whole, gulab ki patti, full fat milk, mawa (unsweetened), sugar, Few strands of saffron",diwali,veg,1,Calcium,230
869,Ruwangan Hachi Chaman,cheese," cottage cheese (deep fried), tomatoes (boiled and sun dried), onion, garlic, green cardamom, black cardamom, cinnamon sticks, bay leaves, turmeric, red mirch powder, saunf powder, dry ginger powder, coriander powder, salt, mustard oil, desi ghee",diwali,veg,2,Vitamin_c,205
870,Peshawari Chapli Kebab,kebab," mutton (with fat), onions, tomatoes (peeled and deseeded), Tomato slices, Black pepper, coriander seeds, salt, cooking oil",diwali,non-veg,2,Phosphorus,620
871,Chocolate Appo,chocolate," rice, coconut, baking powder, vanilla extract, cinnamon powder, brown sugar, unsweetened cocoa powder, salt, chocolate chips, butter",diwali,veg,5,Magnesium,665
872,Red Rice Vermicelli Kheer,kheer," red rice vermicelli / broken sooji / semolina vermicelli, butter, almonds, whole milk, cardamom powder, saffron strands / thread, sugar",diwali,veg,5,Carbohydrates,270
873,Tulsi Ajwain Ka Mahi Tikka,tikka," river sole fish, basil paste, ajwain, ginger and garlic paste, green chilli paste, garam masala powder, cardamom powder, hung curd, dairy cream, salt, mustard oil, kasuri methi, lemon juice",diwali,veg,2,Iodine,555
874,Dahi Anjeer Ke Kebab,kebab," anjeer, hung curd, paneer, chana powder, bread crumbs, ginger, green chilli, green coriander, ghee, garam masala powder, elaichi powder, jeera powder, salt",diwali,non-veg,4,Phosphorus,570
877,Multi-layered Ghevar,ghevar," maida, cornflour, ghee (cooled), sugar, water, arrowroot",diwali,veg,1,Carbohydrates,240
878,Nazaqati Boti Kebab,kebab," mutton cubes (extra clean, from male goat thigh), ginger paste, raw papaya paste, white onion paste, brown onion, desi ghee, yellow chilli powder, coriander powder, salt, garam masala, potli masala, chana dal flavour, curd, rose petal paste, saffron, poppy seeds paste, cashew paste, almond paste, chiroli paste, dessicated coconut poqder, kewra, clove, green cardamom",diwali,non-veg,3,Phosphorus,495
879,Almond And Raw Banana Galawat,banana," almond slivers, raw banana (boiled), almond paste, cooking cream, refined oil, mace powder, cardamom powder , ginger garlic paste, garam masala powder, red chilli powder, salt, tempura batter",diwali,veg,3,Selenium,575
880,Grilled Almond Barfi (Sugar Free),barfi," khoya, sweetener (optional), almonds (crushed)",diwali,veg,4,Calcium,300
881,Chocolate Kaju Katli,kaju," cashew nuts, sugar, water, milk chocolate or dark chocolate",diwali,veg,3,Vitamin_D,510
882,Anjeer Kaju Roll,kaju," cashew nuts, figs, sugar, pistachio, green cardamom powder, saffron, honey, beetroot juice",diwali,veg,4,Iron,235
883,Mix Fruit Laccha Rabri Tortilla Crunch,rabri," milk, sugar, cardamom powder, saffron, almonds and pistachios, grapes, apple, kiwi, orange, pomegranate, mint leaves, tortilla sheet, oil",diwali,veg,2,Calcium,305
884,Kalmi Kebab,kebab," Chicken thigh leg, Yogurt, Ginger-garlic paste, Lemon juice, Turmeric powder, Caraway seeds, Cashew nut powder, Green cardamom powder, Black pepper (crushed), Fresh cream, Refined oil",diwali,non-veg,4,Phosphorus,540
886,Makhane Aur Kaju Ki Kheer,kheer," Lotus Seeds (puffed) and cashew nut (toasted), Milk, Pure ghee, Khoya/Mawa, Green cardamom powder, Almonds, Pistachios",diwali,veg,5,Magnesium,465
887,Apple Rabdi,rabdi," Apples, Milk, Sugar, Green cardamoms, Almonds (blanched), Pistachios (blanched)",diwali,veg,5,Calcium,490
888,Baked Namak Para,baked," Whole wheat flour (atta), Refined flour (maida), Baking powder, Ghee, Salt, Carom seeds (ajwain)",diwali,veg,2,Magnesium,530
889,Dates And Nuts Ladoo,ladoo," dates (pitted), mixed nuts (almonds, cashews, walnuts, pistachios, peanuts), dessicated coconut (optional)",diwali,veg,3,Vitamin_E,400
890,Murg Bemisal,chilli," Chicken breast, Cheese, Green chilli, Ginger, Salt, Whole jeera, Garlic, Onion, Tomato paste, Desi ghee, Cashew paste, Turmeric powder, Red chilli powder, Yellow chilli powder, Jeera powder, Kasoori methi, Garam masala, Cooking oil",diwali,veg,5,Iron,550
891,Gehun Ki Kheer,kheer," Broken wheat, Ghee, Raisin, Cardamom powder, Jaggery, Cashew nut, Milk",diwali,veg,2,Vitamin_D,625
