Meal_Id,Name,catagory,description,Veg_Non,Nutrient,Disease,Diet,Price
meal_id51,christmas chocolate fudge cookies,cookie,"मक्खन, ब्राउन शुगर, चॉकलेट, चॉकलेट चिप्स, अंडे , आटा, कोको पाउडर, बेकिंग पाउडर",veg,magnesium, hypertension heart_disease, high_protien_diet high_fiber_diet ketogenic_diet,545
meal_id5,gluten-free christmas cake,cake,"क्रिसमस ड्राई फ्रूट्स (पहले से भीगे हुए),  संतरे का छिलका, नींबू का छिलका, गुड़ का सिरप, बादाम का आटा, सेब, मक्खन, अंडे",veg,potassium, goitre kidney_disease, high_protien_diet low_fat_diet high_fiber_diet ketogenic_diet,630
meal_id235,whole wheat cake,cake,"ओवन तापमान , गेंहू का आटा, गुड़ की शक्कर, बेकिंग पाउडर, तेल, अंडे, पानी, बादाम एसेंस, अखरोट",veg,potassium, kidney_disease, low_fat_diet ketogenic_diet low_sodium_diet vegan_diet high_fiber_diet high_protien_diet dash_diet,395
meal_id236,plum cake,cake,"ओवन तापमान:, बटर, चीनी, अंडे, बादाम, वनीला एसेंस, मिक्स ड्राई फ्रूट , आटा ,",veg,potassium, scurvy, low_fat_diet high_fiber_diet ketogenic_diet,665
meal_id237,double chocolate easter cookies,cookie,"मक्खन, ब्राउन शुगर, कैस्टर शुगर, वनिला एसेंस, डार्क चॉकलेट, रिफाइंड फ्लॉर, कोको पाउडर, बेकिंग सोडा, नमक, दूध, कैडबरी जेम्स",veg,magnesium, diabeties hypertension heart_disease scurvy, high_protien_diet high_fiber_diet ketogenic_diet,460
meal_id53,chocolate appo,chocolate,"rice, coconut, baking powder, vanilla extract, cinnamon powder, brown sugar, unsweetened cocoa powder, salt, chocolate chips, butter",veg,magnesium, hypertension heart_disease, high_protien_diet high_fiber_diet ketogenic_diet,610
meal_id163,red rice vermicelli kheer,kheer,"red rice vermicelli / broken sooji / semolina vermicelli, butter, almonds, whole milk, cardamom powder, saffron strands / thread, sugar",veg,carbohydrates, anemia pregnancy cancer scurvy kidney_disease obesity diabeties, alkaline_diet ketogenic_diet vegan_diet high_protien_diet dash_diet,325
meal_id16,almond and raw banana galawat,banana,"almond slivers, raw banana (boiled), almond paste, cooking cream, refined oil, mace powder, cardamom powder , ginger garlic paste, garam masala powder, red chilli powder, salt, tempura batter",veg,selenium, anemia hypertension cancer scurvy heart_disease kidney_disease diabeties, alkaline_diet low_fat_diet ketogenic_diet gluten_free_diet vegan_diet high_fiber_diet high_protien_diet,510
meal_id18,grilled almond barfi (sugar free),barfi,"khoya, sweetener (optional), almonds (crushed)",veg,calcium, goitre hypertension, low_fat_diet ketogenic_diet gluten_free_diet vegan_diet high_protien_diet,230
meal_id200,chocolate kaju katli,kaju,"cashew nuts, sugar, water, milk chocolate or dark chocolate",veg,vitamin_d, hypertension heart_disease, high_fiber_diet ketogenic_diet,335
meal_id201,mix fruit laccha rabri tortilla crunch,rabri,"milk, sugar, cardamom powder, saffron, almonds and pistachios, grapes, apple, kiwi, orange, pomegranate, mint leaves, tortilla sheet, oil",veg,calcium, pregnancy hypertension scurvy heart_disease eye_disease obesity diabeties, alkaline_diet low_fat_diet ketogenic_diet low_sodium_diet vegan_diet high_fiber_diet hormone_diet high_protien_diet,665
meal_id21,apple rabdi,rabdi,"apples, milk, sugar, green cardamoms, almonds (blanched), pistachios (blanched)",veg,calcium, obesity diabeties, high_protien_diet vegan_diet low_fat_diet ketogenic_diet,690
meal_id22,baked namak para,baked,"whole wheat flour (atta), refined flour (maida), baking powder, ghee, salt, carom seeds (ajwain)",veg,magnesium, goitre, low_sodium_diet high_protien_diet low_fat_diet high_fiber_diet,505
meal_id23,dates and nuts ladoo,ladoo,"dates (pitted), mixed nuts (almonds, cashews, walnuts, pistachios, peanuts), dessicated coconut (optional)",veg,vitamin_e, anemia cancer heart_disease kidney_disease obesity diabeties, alkaline_diet omni_diet ketogenic_diet low_sodium_diet vegan_diet high_fiber_diet gluten_free_diet dash_diet,240
meal_id128,mongolian lamb balls,lamb,"lamb (minced), couscous, scallion, garlic, egg, parsley, olive oil, mint, ao nori herb, salt, five spice, cinnamon powder",non-veg,iron, goitre, vegan_diet low_fat_diet high_fiber_diet,245
meal_id31,baked almond kofta,kofta,"potato (boiled), nutmeg, milk, almonds (crushed), green onions, refined flour, egg, salt, pepper, eggs, refined flour (for rolling), dried breadcrumbs (for rolling)",veg,calcium, goitre hypertension, low_fat_diet ketogenic_diet low_sodium_diet gluten_free_diet vegan_diet high_fiber_diet high_protien_diet,465
meal_id32,almond and amaranth ladoo,ladoo,"popped amaranth seeds, jaggery, almonds (slivered, unpeeled)",veg,calcium, hypertension, low_fat_diet ketogenic_diet gluten_free_diet vegan_diet high_protien_diet,570
meal_id238,holi special malai kofta,kofta,"potatoes, paneer (cottage cheese), maida, coriander leaves (chopped), onion, ginger-garlic paste, tomatoes, malai or cream, raisins and cashew nuts, cashew nuts paste, haldi, red chilli powder, kitchen king masala, kasuri methi (dry fenugreek), salt, sugar",veg,phosphorus, kidney_disease, vegan_diet low_fat_diet high_fiber_diet,535
meal_id239,homemade gulab jamun,gulab,"sugar, water, milk, cardamom seeds, saffron, cardamom powder, khoya, baking soda, maida, milk",veg,vitamin_d, goitre, low_sodium_diet,445
meal_id100,spicy chicken curry,curry,"oil, ghee, onion paste, garlic paste, ginger paste, turmeric powder, salt, tomato puree, coriander powder, red chilli powder, cumin powder, garam masala, chicken leg pieces, coriander leaves, water",non-veg,iron, anemia pregnancy rickets goitre kidney_disease obesity, low_fat_diet low_carb_diet vegan_diet high_fiber_diet hormone_diet high_protien_diet type_a_diet,545
meal_id163,red rice vermicelli kheer,kheer,"रेड राइस वर्मिसेली/ ब्रोकन सूजी/ सूजी वर्मिसेली, मक्खन, बादाम, पूरा दूध, इलाइची पाउडर, केसर थ्रेड  चीनी, चीनी",veg,carbohydrates, anemia pregnancy cancer scurvy kidney_disease obesity diabeties, alkaline_diet ketogenic_diet vegan_diet high_protien_diet dash_diet,270
meal_id130,chicken shami kebab,kebab,"चना दाल, तेल, जीरा, लौंग, काली मिर्च, दालचीनी, साबुत धनिया, अजवाइन, साबुत लाल मिर्च, चिली फलेक्स, बोनलेस चिकन, नमक, पानी, अदरक, हरी मिर्च, लहसुन, हरा धनिया, पुदीने के पत्ते, अंडे",non-veg,phosphorus, anemia rickets goitre kidney_disease pregnancy, low_fat_diet low_carb_diet vegan_diet high_fiber_diet hormone_diet high_protien_diet type_a_diet,500
meal_id240,lamb rogan josh,lamb,"lamb chops or stewing lamb, vegetable oil, cassia bark or cinnamon stick, bay leaves, green cardamoms, onions, garlic cloves, butter, turmeric, chilli powder, ground cumin, ground coriander, tomato puree, salt, garam masala, lemon juice",non-veg,iron, goitre, vegan_diet low_fat_diet high_fiber_diet,345
meal_id241,fish curry,curry,"fresh sole fish, black pepper powder, lemon (juiced), onion, coriander seeds, black pepper, raw rice, garlic cloves, coconut, coriander leaves, ginger (large), cinnamon powder, clove powder, ground nut oil, tamarind paste, cooking oil, salt,",non-veg,vitamin_a, anemia pregnancy hypertension cancer heart_disease rickets goitre kidney_disease obesity diabeties, alkaline_diet low_fat_diet ketogenic_diet vegan_diet high_protien_diet dash_diet low_carb_diet,205
meal_id242,rice kheer,kheer,"milk, rice (washed), sugar, raisins, green cardamoms, almonds (shredded)",veg,calcium, obesity diabeties anemia, low_fat_diet ketogenic_diet vegan_diet high_protien_diet dash_diet,300
meal_id74,slow cooked spiced sangria,sangria,"red wine (merlot / zinfandel), apple cider, honey, orange (zested and juiced), cloves (whole), green cardamom, cinnamon sticks, anise (whole), brandy",veg,iron, anemia pregnancy scurvy heart_disease goitre kidney_disease obesity diabeties, vegan_diet low_fat_diet high_fiber_diet ketogenic_diet,460
meal_id221,"amaranthus granola with lemon yogurt, berries and marigold",yogurt,"popped amaranthus (cholai), oats, almonds, cinnamon powder, sunflower seeds, sesame seeds, honey, brown sugar, salt, olive oil, lemon rind, plain yogurt (whipped with lemon rind), blueberries",veg,calcium, pregnancy hypertension scurvy heart_disease goitre kidney_disease obesity, low_fat_diet omni_diet Mediterranean_diet ketogenic_diet low_sodium_diet vegan_diet high_protien_diet dash_diet,380
meal_id222,chocolate fudge cookies,cookie,"dark chocolate coverture, butter, sugar, eggs, flour, baking powder, salt, cocoa powder, vanilla essence",veg,magnesium, hypertension heart_disease, high_protien_diet high_fiber_diet ketogenic_diet,550
meal_id243,assorted rice kheer sushi,kheer,"basmati rice, milk, sugar, pistachio, almonds, green cardamoms(powdered), saffron, rose water, rose petals (dried), dark chocolate",veg,magnesium, obesity diabeties anemia, alkaline_diet ketogenic_diet vegan_diet high_fiber_diet high_protien_diet dash_diet,495
meal_id244,jalebi with fennel yogurt pudding,pudding,"all purpose flour, yogurt, oil, sugar, water, saffron, green cardamom, yogurt (strained), milk (warm), sugar, nutmeg, cardamom powder",veg,vitamin_d, pregnancy hypertension goitre obesity diabeties, low_fat_diet ketogenic_diet gluten_free_diet high_protien_diet dash_diet,500
meal_id224,eggless vanilla cake,cake,"maida, baking powder, castor sugar, butter, milk, vanilla essence, vinegar",veg,potassium, goitre, low_fat_diet high_fiber_diet ketogenic_diet,520
meal_id225,sweet potato pie,pie,"yams (red skinned), condensed milk, sugar, egg , cinnamon , marshmallows ,",veg,vitamin_a, hypertension scurvy goitre kidney_disease pregnancy, alkaline_diet low_fat_diet paleo_diet Mediterranean_diet low_sodium_diet gluten_free_diet high_fiber_diet high_protien_diet dash_diet,415
meal_id245,broccoli souffle,broccoli,"broccoli, butter, extra virgin olive oil, all-purpose flour, low fat milk, salt, black pepper, cheddar cheese, eggs (separated), egg whites, cream of tarter",veg,vitamin_c, pregnancy diabeties scurvy, alkaline_diet ketogenic_diet vegan_diet high_protien_diet dash_diet,610
meal_id228,chocolate chip cheesecake,chocolate,"butter biscuits (broken into pieces), butter (softened), cream cheese (softened), sugar, egg, rose essence or vanilla essence, chocolate chips",veg,calcium, hypertension heart_disease, low_fat_diet ketogenic_diet vegan_diet high_fiber_diet high_protien_diet,300
meal_id230,eggless coffee cupcakes,coffee,"maida/ flour, baking powder, sugar, cocoa powder, vanilla essence, butter (softened, salted. in case you are using unsalted butter, add 1/4 tsp salt), milk (to make the batter smooth. adjust the milk quantity according to your batter's smoothness), coffee powder + 1 tsp water, to make a paste (you can increase or decrease according to your coffee tolerance)",veg,vitamin_d, pregnancy anemia, ketogenic_diet hormone_diet,625
meal_id236,plum cake,cake,"oven temp: 150 c-300 f, butter, sugar, eggs, almonds, vanilla essence, mixed fruits (sultanas, raisins, candied peels and cherries), refined flour,",veg,potassium, scurvy, low_fat_diet high_fiber_diet ketogenic_diet,570
meal_id246,christmas dry fruit cake,cake,"butter (at room temperature), dark brown sugar, eggs, flour, salt, all spice powder, cinnamon, nutmeg, currants; golden raisins; dark raisins (each), soft dried figs, dates (pitted), prunes (stoned dried), apricots (dried), almonds (chopped), brandy, instant espresso (mixed with 1 tbsp water)",veg,calcium, pregnancy hypertension scurvy heart_disease eye_disease obesity diabeties, alkaline_diet low_fat_diet ketogenic_diet vegan_diet high_fiber_diet high_protien_diet,390
meal_id247,microwave chicken steak,chicken,"chicken breasts (boneless), eggs (slightly whisked), ginger paste, garlic paste, onions, coriander leaves, green chillies, black pepper powder, flour, vinegar, salt, oil",non-veg,vitamin_a, anemia rickets goitre kidney_disease pregnancy, low_fat_diet low_carb_diet vegan_diet hormone_diet high_protien_diet type_a_diet,370
meal_id248,cheese and ham roll,cheese,"hung curd, butter, cream, ground pimento, lemon juice, vodka, salt and pepper, asparagus spears(cooked), ham, pineapple slices",veg,calcium, obesity eye_disease, alkaline_diet low_fat_diet ketogenic_diet vegan_diet high_protien_diet dash_diet,410
meal_id249,vegetable manchurian,tomato,"mixed vegetables - chopped fine or grated, eggs (slightly beaten), refined flour, garlic paste, ginger paste, water, oil , garlic , onions , capsicum, cornflour (blended with water), vinegar, salt, soya sauce, tomato puree, celery, ajinomoto (optional), water",veg,vitamin_a, obesity scurvy kidney_disease heart_disease, low_fat_diet low_sodium_diet gluten_free_diet vegan_diet high_fiber_diet high_protien_diet,560
meal_id250,jerk chicken,chicken,"chicken legs, lime (halved), jerk seasoning powder (bottled), jerk seasoning paste (bottled), olive oil",non-veg,iron, anemia rickets goitre kidney_disease pregnancy, low_fat_diet low_carb_diet vegan_diet high_fiber_diet hormone_diet high_protien_diet type_a_diet,255
meal_id251,lemon poppy seed cake hindi,cake,"आटा, बेकिंग पाउडर, नमक, कैस्टर शुगर, बेकिंग सोडा, अंडे, मक्खन, वनिला एसेंस, नींबू का रस, खसखस, नींबू का छिलका, लेमन सिरप, विप्ड क्रीम, फ्रेश बेरी",veg,potassium, scurvy, high_protien_diet low_fat_diet high_fiber_diet ketogenic_diet,220
meal_id252,steam bunny chicken bao hindi,bao,"बन्स, मैदा, ड्राई यीस्ट, चीनी, नमक , गर्म पानी, चिकन कीमा, अंडे, सोय सॉस, चीनी, तिल का तेल, वूस्टरशर सॉस, चाइव्स, अरोमैट पाउडर",non-veg,iron, anemia rickets goitre kidney_disease pregnancy, low_fat_diet low_carb_diet vegan_diet high_fiber_diet hormone_diet high_protien_diet type_a_diet,630
meal_id253,double chocolate easter cookies hindi,cookie,"मक्खन, ब्राउन शुगर, कैस्टर शुगर, वनिला एसेंस, डार्क चॉकलेट, रिफाइंड फ्लॉर, कोको पाउडर, बेकिंग सोडा, नमक, दूध, कैडबरी जेम्स",veg,magnesium, diabeties hypertension heart_disease scurvy, high_protien_diet high_fiber_diet ketogenic_diet,310
meal_id212,al hachi chicken,chicken,"shallow fried chicken, bottle gourd (boiled and sun dried), onion, garlic, whole spices:, green cardamom, black cardamom, cinnamon sticks, turmeric, deggi mirch, fennel seeds powder, dry ginger powder, coriander powder, salt, mustard oil, desi ghee",non-veg,magnesium, anemia rickets goitre kidney_disease pregnancy, low_fat_diet low_carb_diet vegan_diet high_fiber_diet hormone_diet high_protien_diet type_a_diet,575
meal_id128,mongolian lamb balls,lamb,"lamb (minced), couscous, scallion, garlic, egg, parsley, olive oil, mint, ao nori herb, salt, five spice, cinnamon powder",non-veg,iron, goitre, vegan_diet low_fat_diet high_fiber_diet,220
meal_id31,baked almond kofta,kofta,"potato (boiled), nutmeg, milk, almonds (crushed), green onions, refined flour, egg, salt, pepper, eggs, refined flour (for rolling), dried breadcrumbs (for rolling)",veg,calcium, goitre hypertension, low_fat_diet ketogenic_diet low_sodium_diet gluten_free_diet vegan_diet high_fiber_diet high_protien_diet,525
meal_id254,orange quinoa sevaiyan,almond,"sevaiyan, quinoa, orange juice , dried figs, sugar, almond milk, desi ghee, jaggery, walnuts, melon seeds, peanuts",veg,protien, anemia scurvy rickets goitre pregnancy, low_sodium_diet vegan_diet low_fat_diet dash_diet,480
meal_id100,spicy chicken curry,curry,"oil, ghee, onion paste, garlic paste, ginger paste, turmeric powder, salt, tomato puree, coriander powder, red chilli powder, cumin powder, garam masala, chicken leg pieces, coriander leaves, water",non-veg,iron, anemia pregnancy rickets goitre kidney_disease obesity, low_fat_diet low_carb_diet vegan_diet high_fiber_diet hormone_diet high_protien_diet type_a_diet,505
meal_id243,assorted rice kheer sushi,kheer,"basmati rice, milk, sugar, pistachio, almonds, green cardamoms(powdered), saffron, rose water, rose petals (dried), dark chocolate",veg,magnesium, obesity diabeties anemia, alkaline_diet ketogenic_diet vegan_diet high_fiber_diet high_protien_diet dash_diet,395
meal_id244,jalebi with fennel yogurt pudding,pudding,"all purpose flour, yogurt, oil, sugar, water, saffron, green cardamom, yogurt (strained), milk (warm), sugar, nutmeg, cardamom powder",veg,vitamin_d, pregnancy hypertension goitre obesity diabeties, low_fat_diet ketogenic_diet gluten_free_diet high_protien_diet dash_diet,225
meal_id255,spicy creamy kadai chicken,chicken,"chicken, ginger-garlic paste, pepper powder, lime juice, oil, salt, tomatoes, green chillies, ginger-garlic paste, chilli powder, black cardamoms, cloves, water, onion, ginger, green chillies, chilli powder, turmeric powder, garam masala, kasturi methi, cream",non-veg,iron, anemia pregnancy rickets goitre kidney_disease obesity, low_fat_diet low_carb_diet vegan_diet high_fiber_diet hormone_diet high_protien_diet type_a_diet,410
meal_id256,apple kheer,kheer,"apples, basmati rice, nuscovado sugar (you can also use normal sugar), cashew nuts and almonds, cassia bark or cinnamon stick, red grapes",veg,vitamin_e, obesity diabeties, high_protien_diet,355
meal_id257,ragi oats ladoo (laddu),ladoo,"ragi flour, oats flour, dates (ripe), milk, honey, ghee, green cardamom powder, white sesame seeds, coconut powder, cashew nuts",veg,vitamin_e, hypertension, high_protien_diet dash_diet gluten_free_diet,675
meal_id258,lamb korma,korma,"onions, almond paste, ghee, cinnamon sticks, green cardamom, cloves, mace, bay leaves, garlic paste, ginger paste, lamb, salt, rose water (infused with 4-5 strands of saffron), yellow chilli powder, yogurt, yellow chilli powder, black pepper powder, coriander seed powder, cumin powder, red chilli powder, turmeric powder, clove powder, green cardamom powder, rose petal powder, nutmeg powder, black cardamom powder, fennel powder, cinnamon powder, mace powder, onions, cream/malai",non-veg,iron, goitre, vegan_diet low_fat_diet high_fiber_diet,265
meal_id259,ragi coconut ladoo (laddu),ladoo,"finger millet flour (ragi), jaggery, peanuts, coconut, salt",veg,chloride, obesity hypertension, paleo_diet ketogenic_diet high_fiber_diet gluten_free_diet dash_diet,610
meal_id163,red rice vermicelli kheer,kheer,"रेड राइस वर्मिसेली/ ब्रोकन सूजी/ सूजी वर्मिसेली, मक्खन, बादाम, पूरा दूध, इलाइची पाउडर, केसर थ्रेड  चीनी, चीनी",veg,carbohydrates, anemia pregnancy cancer scurvy kidney_disease obesity diabeties, alkaline_diet ketogenic_diet vegan_diet high_protien_diet dash_diet,630
meal_id130,chicken shami kebab,kebab,"चना दाल, तेल, जीरा, लौंग, काली मिर्च, दालचीनी, साबुत धनिया, अजवाइन, साबुत लाल मिर्च, चिली फलेक्स, बोनलेस चिकन, नमक, पानी, अदरक, हरी मिर्च, लहसुन, हरा धनिया, पुदीने के पत्ते, अंडे",non-veg,phosphorus, anemia rickets goitre kidney_disease pregnancy, low_fat_diet low_carb_diet vegan_diet high_fiber_diet hormone_diet high_protien_diet type_a_diet,510
meal_id260,quick chicken curry,curry,"चिकन, प्याज का पेस्ट, टमाटर, लहसुन का पेस्ट, अदरक का पेस्ट, धनिया पाउडर, जीरा पाउडर, हल्दी पाउडर, लाल मिर्च पाउडर, गरम मसाला पाउडर, तेल, नमक, हरा धनिया",non-veg,iron, anemia hypertension rickets goitre kidney_disease pregnancy, alkaline_diet low_fat_diet low_carb_diet ketogenic_diet vegan_diet high_fiber_diet hormone_diet high_protien_diet type_a_diet,400
meal_id255,spicy creamy kadai chicken,chicken,"चिकन, अदरक-लहसुन पेस्ट, कालीमिर्च पाउडर, नींबू का रस, तेल, नमक, टमाटर, हरी मिर्च, अदरक-लहसुन का पेस्ट, लाल मिर्च पाउडर, बड़ी इलाइची, लौंग , पानी, प्याज़ , अदरक, हरी मिर्च, लाल मिर्च , हल्दी पाउडर, गरम मसाला, कसूरी मेथी, क्रीम",non-veg,iron, anemia pregnancy rickets goitre kidney_disease obesity, low_fat_diet low_carb_diet vegan_diet high_fiber_diet hormone_diet high_protien_diet type_a_diet,485
meal_id261,chicken shaami kebab,kebab,"चना दाल, चिकन थाई , नमक, साबुत लाल मिर्च, जीरा , साबुत धनिया, लौंग, ​कालीमिर्च साबुत , दालचीनी स्टिक , अजवाइन, अंडे, हरा धनिया , पुदीने , हरी मिर्च, अदरक, लहसुन की कलियां, तेल",non-veg,phosphorus, anemia rickets goitre kidney_disease pregnancy, low_fat_diet low_carb_diet vegan_diet high_fiber_diet hormone_diet high_protien_diet type_a_diet,245
meal_id262,chicken masala,chicken,"चिकन , अदरक  , लहसुन, प्याज, टमाटर , गरम मसाला, तेजपत्ता, नमक , हल्दी, धनिया पाउडर, लाल मिर्च पाउडर, तेल, हरा धनिया , क्रीम",non-veg,iron, anemia rickets goitre kidney_disease pregnancy, low_fat_diet low_carb_diet vegan_diet high_fiber_diet hormone_diet high_protien_diet type_a_diet,340
meal_id65,almond &amp; white chocolate gujiya,gujiya,"all-purpose flour, clarified butter (ghee), water, white chocolate, dessicated coconut, green cardamom powder, almond, jaggery",veg,magnesium, anemia hypertension scurvy heart_disease rickets kidney_disease obesity, low_fat_diet omni_diet ketogenic_diet gluten_free_diet high_fiber_diet hormone_diet high_protien_diet,585
meal_id53,chocolate appo,chocolate,"rice, coconut, baking powder, vanilla extract, cinnamon powder, brown sugar, unsweetened cocoa powder, salt, chocolate chips, butter",veg,magnesium, hypertension heart_disease, high_protien_diet high_fiber_diet ketogenic_diet,475
meal_id163,red rice vermicelli kheer,kheer,"red rice vermicelli / broken sooji / semolina vermicelli, butter, almonds, whole milk, cardamom powder, saffron strands / thread, sugar",veg,carbohydrates, anemia pregnancy cancer scurvy kidney_disease obesity diabeties, alkaline_diet ketogenic_diet vegan_diet high_protien_diet dash_diet,315
meal_id16,almond and raw banana galawat,banana,"almond slivers, raw banana (boiled), almond paste, cooking cream, refined oil, mace powder, cardamom powder , ginger garlic paste, garam masala powder, red chilli powder, salt, tempura batter",veg,selenium, anemia hypertension cancer scurvy heart_disease kidney_disease diabeties, alkaline_diet low_fat_diet ketogenic_diet gluten_free_diet vegan_diet high_fiber_diet high_protien_diet,485
meal_id18,grilled almond barfi (sugar free),barfi,"khoya, sweetener (optional), almonds (crushed)",veg,calcium, goitre hypertension, low_fat_diet ketogenic_diet gluten_free_diet vegan_diet high_protien_diet,360
meal_id200,chocolate kaju katli,kaju,"cashew nuts, sugar, water, milk chocolate or dark chocolate",veg,vitamin_d, hypertension heart_disease, high_fiber_diet ketogenic_diet,530
meal_id56,chocolate samosa,samosa,"refined flour, desi ghee, black cardamom seeds, chocolate block, almonds, cashew nuts, pistachio, sugar, garam masala powder, oil",veg,magnesium, hypertension heart_disease, high_protien_diet high_fiber_diet ketogenic_diet,460
meal_id21,apple rabdi,rabdi,"apples, milk, sugar, green cardamoms, almonds (blanched), pistachios (blanched)",veg,calcium, obesity diabeties, high_protien_diet vegan_diet low_fat_diet ketogenic_diet,555
meal_id22,baked namak para,baked,"whole wheat flour (atta), refined flour (maida), baking powder, ghee, salt, carom seeds (ajwain)",veg,magnesium, goitre, low_sodium_diet high_protien_diet low_fat_diet high_fiber_diet,260
