Meal_Id,Name,catagory,description,Veg_Non,Nutrient,Disease,Diet,Price
meal_id63,flax seed and beetroot modak,modak,"rice flour, salt, oil (for greasing), beetroot puree, tossed flax seeds (for topping), fresh coconut, jaggery, poppy seeds, green cardamom powder, nutmeg powder",veg,magnesium, goitre hypertension heart_disease, high_protien_diet vegan_diet high_fiber_diet,315
meal_id199,lemon poppy seed cake,cake,"plain flour, baking powder, salt, castor sugar, baking soda, eggs, butter, vanilla essence, lemon juice, poppy seed, lemon peel, to serve:, lemon syrup, whip cream, fresh berry",veg,potassium, scurvy, high_protien_diet low_fat_diet high_fiber_diet ketogenic_diet,380
meal_id64,chocolate prunes gujiyas,chocolate,"for gujiya pastry:, refined flour, ghee, water, salt, for gujiya stuffing:, dark chocolate, prunes, mawa, sugar, cardamom",veg,magnesium, hypertension heart_disease, high_protien_diet high_fiber_diet ketogenic_diet,475
meal_id65,almond &amp; white chocolate gujiya,gujiya,"all-purpose flour, clarified butter (ghee), water, white chocolate, dessicated coconut, green cardamom powder, almond, jaggery",veg,magnesium, anemia hypertension scurvy heart_disease rickets kidney_disease obesity, low_fat_diet omni_diet ketogenic_diet gluten_free_diet high_fiber_diet hormone_diet high_protien_diet,255
meal_id68,gajar halwa tart,halwa,"white butter, breakfast sugar, milk full fat, refined flour, winter carrots, ghee, sugar, khoya, cardamom powder, cashew nuts (crushed), almonds (crushed), full fat milk, full fat milk, grain sugar, green cardamom powder",veg,vitamin_d, kidney_disease, low_fat_diet,205
meal_id51,christmas chocolate fudge cookies,cookie,"unsalted butter, brown sugar, chocolate, chocolate chips, eggs, flour, cocoa powder, baking powder",veg,magnesium, hypertension heart_disease, high_protien_diet high_fiber_diet ketogenic_diet,655
meal_id5,gluten-free christmas cake,cake,"christmas dry fruits (pre-soaked), orange zest, lemon zest, jaggery syrup, almond flour, apple, butter (softened), eggs",veg,vitamin_a, goitre kidney_disease, high_protien_diet,205
meal_id53,chocolate appo,chocolate,"rice, coconut, baking powder, vanilla extract, cinnamon powder, brown sugar, unsweetened cocoa powder, salt, chocolate chips, butter",veg,magnesium, hypertension heart_disease, high_protien_diet high_fiber_diet ketogenic_diet,250
meal_id163,red rice vermicelli kheer,kheer,"red rice vermicelli / broken sooji / semolina vermicelli, butter, almonds, whole milk, cardamom powder, saffron strands / thread, sugar",veg,carbohydrates, anemia pregnancy cancer scurvy kidney_disease obesity diabeties, alkaline_diet ketogenic_diet vegan_diet high_protien_diet dash_diet,340
meal_id18,grilled almond barfi (sugar free),barfi,"khoya, sweetener (optional), almonds (crushed)",veg,calcium, goitre hypertension, low_fat_diet ketogenic_diet gluten_free_diet vegan_diet high_protien_diet,575
meal_id200,chocolate kaju katli,kaju,"cashew nuts, sugar, water, milk chocolate or dark chocolate",veg,vitamin_d, hypertension heart_disease, high_fiber_diet ketogenic_diet,665
meal_id56,chocolate samosa,samosa,"refined flour, desi ghee, black cardamom seeds, chocolate block, almonds, cashew nuts, pistachio, sugar, garam masala powder, oil",veg,magnesium, hypertension heart_disease, high_protien_diet high_fiber_diet ketogenic_diet,330
meal_id201,mix fruit laccha rabri tortilla crunch,rabri,"milk, sugar, cardamom powder, saffron, almonds and pistachios, grapes, apple, kiwi, orange, pomegranate, mint leaves, tortilla sheet, oil",veg,calcium, pregnancy hypertension scurvy heart_disease eye_disease obesity diabeties, alkaline_diet low_fat_diet ketogenic_diet low_sodium_diet vegan_diet high_fiber_diet hormone_diet high_protien_diet,225
meal_id21,apple rabdi,rabdi,"apples, milk, sugar, green cardamoms, almonds (blanched), pistachios (blanched)",veg,calcium, obesity diabeties, high_protien_diet vegan_diet low_fat_diet ketogenic_diet,495
meal_id23,dates and nuts ladoo,ladoo,"dates (pitted), mixed nuts (almonds, cashews, walnuts, pistachios, peanuts), dessicated coconut (optional)",veg,vitamin_e, anemia cancer heart_disease kidney_disease obesity diabeties, alkaline_diet omni_diet ketogenic_diet low_sodium_diet vegan_diet high_fiber_diet gluten_free_diet dash_diet,400
meal_id24,green lentil dessert fudge,dessert,"whole moong beans, cow ghee, raisins, whole milk, jaggery (organic), ground cardamom, almonds (halved)",veg,calcium, anemia hypertension scurvy heart_disease goitre kidney_disease pregnancy diabeties, alkaline_diet low_fat_diet ketogenic_diet vegan_diet high_fiber_diet hormone_diet high_protien_diet dash_diet,265
meal_id202,pista chocolate &amp; mandarin,chocolate,"पिस्ता, दूध, चीनी, टूटे हुए चावल, हरी इलाइची, वाइट चॉकलेट, दूध, अंडे का पीला भाग, विप्ड क्रीम, वनीला पॉड, मैन्डरिन , चीनी, पानी",veg,magnesium, scurvy hypertension heart_disease, high_protien_diet high_fiber_diet ketogenic_diet,370
meal_id69,banana and maple ice lollies,banana,"केले, ग्रीक योगर्ट, हैवी क्रीम, प्योर मैपल सिरप , नारियल",veg,selenium, hypertension, alkaline_diet low_fat_diet ketogenic_diet vegan_diet high_fiber_diet dash_diet,485
meal_id203,banana and chia tea cake,cake,"बनाना, कैस्टर शुगर, मैदा, तेल, दूध, अंडे, बेकिंग सोडा, अलसी के बीज, बादाम फलेक्स, चिया सीड्स",veg,potassium, hypertension heart_disease goitre obesity diabeties, alkaline_diet low_fat_diet ketogenic_diet vegan_diet high_fiber_diet hormone_diet high_protien_diet,290
meal_id204,chocolate and almond rum ball h,almond,"चॉकलेट स्पॉज एगलेस, डार्क चॉकलेट, सिंगल क्रीम, बादाम, कैस्टर शुगर, इंस्टेंट कॉफी पाउडर, डार्क रम",veg,magnesium, hypertension heart_disease, high_protien_diet high_fiber_diet ketogenic_diet gluten_free_diet,255
meal_id25,cashew nut cookies,cookie,"काजू पेस्ट, घी, खांड, फलैक्स या चिया सीडस, बेकिंग सोडा, बेकिंग पाउडर, वनीला, ओट्स, मैदा आर्गेनिक",veg,protien, hypertension, high_protien_diet vegan_diet dash_diet ketogenic_diet,645
meal_id205,lemon sushi cake,cake,"वनीला प्री मिक्स, जेल, तेल, पानी, अंडे का पीला भाग, नींबू का रस, चीनी, मक्खन, वाइट चॉकलेट, कुकिंग क्रीम, दूध",veg,potassium, scurvy, alkaline_diet low_fat_diet high_fiber_diet ketogenic_diet,200
meal_id206,chocolate doughnut,chocolate,"चीनी, अंडे का पीला भाग, अंडा, मक्खन, यीस्ट, दूध",veg,magnesium, hypertension heart_disease, high_protien_diet high_fiber_diet ketogenic_diet,585
meal_id207,spiced almond banana jaggery cake,cake,"मक्खन, दालचीनी गुड़ पाउडर, जायफल (पीसा हुआ), बादाम, चीनी, अंडे, संतरे का छिलका , केला, मैदा, बेकिंग सोडा, बेकिंग पाउडर, नमक, छाछ, पीसी हुई दालचीनी",veg,potassium, hypertension, alkaline_diet low_fat_diet ketogenic_diet vegan_diet high_fiber_diet gluten_free_diet,545
meal_id208,fennel scented sweet banana fritters,banana,"गेंहू का आटा, केला, गुड़ , दूध या पानी, घी या तेल",veg,selenium, hypertension scurvy goitre kidney_disease pregnancy, alkaline_diet low_fat_diet paleo_diet Mediterranean_diet ketogenic_diet low_sodium_diet vegan_diet high_fiber_diet dash_diet,650
meal_id209,camel milk cake tart,cake,"कैमल मिल्क, चीनी, सिरका, मक्खन, ब्राउन शुगर, मैदा, अंडे",veg,vitamin_d, cancer hypertension kidney_disease rickets, low_fat_diet ketogenic_diet high_fiber_diet high_protien_diet dash_diet,580
meal_id210,quinoa coconut crumble custard,coconut,"क्निोआ (पका हुआ), ओट्स, दालचीनी पाउडर, नमक, ब्राउन शुगर या गुड़, नट्स, कोकोनट्स फलेक्स, अंडे, क्निोआ, नारियल दूध, मैपल सिरप, वनीला एक्ट्रैक्ट, दालचीनी पाउडर, नमक, शहद",veg,protien, obesity pregnancy hypertension goitre, paleo_diet ketogenic_diet low_sodium_diet vegan_diet high_fiber_diet gluten_free_diet dash_diet,375
meal_id44,andhra pan fried pomfret,curry,"white pomfret fish, sunflower refined ooil, red chilli powder, salt, turmeric powder, ginger-garlic paste, lemon (juiced), cumin powder, coriander powder, garam masala, green chilli, curry leaves, coriander",veg,iron, cancer, alkaline_diet low_fat_diet vegan_diet high_fiber_diet hormone_diet,320
meal_id126,andhra crab meat masala,crab,"processed crab meat, refined oil, curry leaves, garlic, green chilli, onion, ginger-garlic paste, coriander, coriander powder, cumin powder, turmeric powder, garam masala powder, kashmiri chilli powder, salt, lemon, chop masala, tomato",non-veg,potassium, anemia pregnancy cancer kidney_disease obesity, type_o_diet low_fat_diet omni_diet ketogenic_diet low_sodium_diet vegan_diet high_fiber_diet high_protien_diet dash_diet,200
meal_id136,malabari fish curry,curry,"sear fish, coconut, ginger, pureed tamarind, salt, powdered turmeric, green chillies, red chilli powder, shallots",non-veg,vitamin_a, anemia pregnancy hypertension cancer heart_disease rickets goitre kidney_disease obesity diabeties, alkaline_diet low_fat_diet ketogenic_diet vegan_diet high_protien_diet dash_diet low_carb_diet,665
meal_id45,ghee roast chicken dosa quesadilla,dosa,"dry red chillies, coriander seeds, cumin seeds, fenugreek seeds, black pepper, clove, garlic, turmeric powder, boneless chicken, curd, lemon (juiced), for cooking chicken:, tamarind pulp, ginger (1 inch), garlic cloves, onion, tomato, ghee, red chilli powder, salt, crushed jaggery, dosa batter (for 4 dosas), processed cheese, ghee or oil (to crisp the dosa), coriander leaves, curry leaves (deep fried), curd, salt, zeera powder, sugar, red chilli powder",non-veg,iron, anemia rickets goitre kidney_disease pregnancy, low_fat_diet low_carb_diet vegan_diet high_fiber_diet hormone_diet high_protien_diet type_a_diet,385
meal_id2,chicken minced salad,salad,"olive oil, chicken mince, garlic (minced), onion, salt, black pepper, carrot, cabbage, green onions, sweet chilli sauce, peanut butter, ginger, soy sauce, fresh cilantro, red pepper flakes (crushed), tarts",non-veg,fiber, anemia pregnancy hypertension rickets goitre kidney_disease obesity, low_fat_diet low_carb_diet ketogenic_diet low_sodium_diet vegan_diet high_fiber_diet hormone_diet high_protien_diet type_a_diet,500
meal_id46,steam bunny chicken bao,bao,"buns, all purpose white flour, dry yeast, sugar, salt, warm water, chicken mince, eggs, soy sauce, sugar, sesame oil, worcestershire sauce, chives, aromat powder",non-veg,iron, anemia rickets goitre kidney_disease pregnancy, low_fat_diet low_carb_diet vegan_diet high_fiber_diet hormone_diet high_protien_diet type_a_diet,680
meal_id211,lamb barley pot,barley,"pot barley, onions, worcestershire sauce, chilli flakes, mustard seeds, thick mutton chunks, thick neck of lamb chops, water or stock (to cover), salt, black pepper (freshly ground)",non-veg,iron, goitre, vegan_diet low_fat_diet high_fiber_diet,355
meal_id65,almond &amp; white chocolate gujiya,gujiya,"all-purpose flour, clarified butter (ghee), water, white chocolate, dessicated coconut, green cardamom powder, almond, jaggery",veg,magnesium, anemia hypertension scurvy heart_disease rickets kidney_disease obesity, low_fat_diet omni_diet ketogenic_diet gluten_free_diet high_fiber_diet hormone_diet high_protien_diet,550
meal_id212,al hachi chicken,chicken,"shallow fried chicken, bottle gourd (boiled and sun dried), onion, garlic, whole spices:, green cardamom, black cardamom, cinnamon sticks, turmeric, deggi mirch, fennel seeds powder, dry ginger powder, coriander powder, salt, mustard oil, desi ghee",non-veg,magnesium, anemia rickets goitre kidney_disease pregnancy, low_fat_diet low_carb_diet vegan_diet high_fiber_diet hormone_diet high_protien_diet type_a_diet,360
meal_id48,almond and chicken momos (without shell),chicken,"chicken mince, garlic, carrots, spring onion, ginger, soya sauce, oyster sauce, sesame oil, pepper powder, egg, almonds (blanched), oil (for greasing)",non-veg,calcium, anemia hypertension rickets goitre kidney_disease pregnancy, low_fat_diet low_carb_diet ketogenic_diet low_sodium_diet gluten_free_diet vegan_diet high_fiber_diet hormone_diet high_protien_diet type_a_diet,460
meal_id213,berry parfait hazelnut white chocolate sable,chocolate,"for berry parfait:, egg yolk, caster sugar, berry puree, cream cheese, double cream, for hazelnut streusel:, ground hazelnut, flour, caster sugar, butter, for hazelnut white chocolate pressed sable:, hazelnut streusel, cocoa butter, puffed rice, clarified butter, melted white chocolate, for flexy berry:, raspberry puree, sugar, liquid glucose, pectin",veg,vitamin_a, anemia hypertension scurvy heart_disease rickets kidney_disease obesity, low_fat_diet omni_diet ketogenic_diet high_fiber_diet hormone_diet high_protien_diet,250
meal_id49,christmas tree pizza,pizza,"pizza dough (2 boules), red pepper, red onion, basil pesto (purchased, homemade or vegan pesto), mozzarella cheese, kosher salt",veg,chloride, goitre, vegan_diet high_fiber_diet,465
meal_id137,portugese fish stew,fish,"sole fillet (you can also do 2/3 types of fish), large shrimps (optional), potatoes (peeled), onions (cut into slices), garlic cloves, red capsicum (can use green also), parsley or coriander (choose the herb that most suits your taste buds), few dashes of hot sauce, paprika, olive oil, white wine, rock salt",non-veg,vitamin_a, anemia pregnancy hypertension cancer heart_disease rickets goitre kidney_disease obesity diabeties, alkaline_diet low_fat_diet ketogenic_diet vegan_diet high_protien_diet dash_diet low_carb_diet,465
meal_id127,cajun spiced turkey wrapped with bacon,wrapped,"turkey breast, cajun spice, spinach leaves (cooked and drained), garlic pods, salted butter, feta cheese, bacon strips, ground black pepper, for cajun spice:, onion powder, garlic powder, seasoning salt, paprika, ground black pepper, cayenne pepper, oregano, thyme, red pepper flakes (if you like it spicy))",non-veg,vitamin_c, cancer, high_protien_diet,635
meal_id214,badam papite ke kebab with pineapple salsa,kebab,"​कच्चा पपीता, कच्चा आलू, बादाम, नमक, हींग, हल्दी, अजवाइन, धनिया, अदरक, हरी मिर्च, बेसन, हरा धनिया, तेल, पाइनएप्पल, प्याज, हरी मिर्च, हरा धनिया, नींबू का रस, नमक , कालीमिर्च",non-veg,phosphorus, goitre kidney_disease, vegan_diet low_fat_diet high_fiber_diet,205
meal_id215,mixed vegetable soup,soup,"मिक्स वेजिटेबल  (टमाटर, गाजर, मटर और फ्रेंच बीन्स), नमक, जीरा पाउडर, तेल, कढ़ीपत्ता",veg,sodium, scurvy heart_disease kidney_disease obesity diabeties, alkaline_diet low_fat_diet low_sodium_diet gluten_free_diet vegan_diet high_fiber_diet high_protien_diet dash_diet,315
meal_id116,pan seared thigh of chicken,chicken,"चिकन थाई, नमक, कालीमिर्च, नींबू, फ्रेश थाइम, बार्ले, ब्रॉकली, मशरूम, एक्ट्रा वर्जिन आॅलिव आॅइल, चेरी टोमैटो",non-veg,iron, anemia rickets goitre kidney_disease pregnancy, low_fat_diet low_carb_diet vegan_diet high_fiber_diet hormone_diet high_protien_diet type_a_diet,435
meal_id117,chicken in mahalak sauce,sauce,"नमक, चीनी, सीजनिंग, तेल, कॉर्न फलोर, चिकन लेग, ताजी लाल मिर्च, लहसुन, अदरक , प्याज, लाल मिर्च पेस्ट, टोमैटो कैचअप, लाल शिमला मिर्च, पीली शिमला मिर्च, वेजिटेबल स्टॉक",non-veg,iron, anemia rickets goitre kidney_disease pregnancy, low_fat_diet low_carb_diet vegan_diet high_fiber_diet hormone_diet high_protien_diet type_a_diet,260
meal_id213,berry parfait hazelnut white chocolate sable,chocolate,"for berry parfait:, egg yolk, caster sugar, berry puree, cream cheese, double cream, for hazelnut streusel:, ground hazelnut, flour, caster sugar, butter, for hazelnut white chocolate pressed sable:, hazelnut streusel, cocoa butter, puffed rice, clarified butter, melted white chocolate, for flexy berry:, raspberry puree, sugar, liquid glucose, pectin",veg,vitamin_a, anemia hypertension scurvy heart_disease rickets kidney_disease obesity, low_fat_diet omni_diet ketogenic_diet high_fiber_diet hormone_diet high_protien_diet,340
meal_id50,belgian pork chop,chop,"pork chop, pink pepper corn, green pepper corn, aromatic sauce, salt, black pepper, salted butter, refined oil, red cabbage, bell pepper chop, apricot, onion, red wine, ancho chilli, cayenne pepper, microgreen",veg,iron, pregnancy goitre, low_fat_diet paleo_diet vegan_diet high_fiber_diet high_protien_diet,640
meal_id186,strawberry &amp; pistachio breton tart,strawberry,"plain flour, baking powder, sea salt, unsalted butter, egg yoks, castor sugar, double cream, yolk, sugar, gelatine, butter, pistachio paste, strawberry",veg,vitamin_a, scurvy kidney_disease, high_protien_diet low_fat_diet,675
meal_id216,duo of chocolate and strawberry,strawberry,"dark chocolate, white chocolate, strawberries",veg,vitamin_c, scurvy hypertension heart_disease, high_fiber_diet ketogenic_diet,220
meal_id217,mustard-parmesan whole roasted cauliflower,roasted,"cauliflowers, garlic, halved, olive oil , dijon mustard , kosher salt , freshly ground black pepper , fresh parsley leaves, parmesan , lemon wedges",veg,chloride, cancer hypertension kidney_disease, alkaline_diet ketogenic_diet vegan_diet high_protien_diet dash_diet,510
meal_id218,hassel back sweet potatoes,vanilla,"sweet potatoes, butter, brown sugar, pure vanilla extract, ground cinnamon, himalayan pink salt / rock salt",veg,chloride, pregnancy hypertension scurvy goitre kidney_disease obesity, alkaline_diet low_fat_diet omni_diet paleo_diet Mediterranean_diet low_sodium_diet high_fiber_diet high_protien_diet dash_diet,655
meal_id74,slow cooked spiced sangria,sangria,"red wine (merlot / zinfandel), apple cider, honey, orange (zested and juiced), cloves (whole), green cardamom, cinnamon sticks, anise (whole), brandy",veg,iron, anemia pregnancy scurvy heart_disease goitre kidney_disease obesity diabeties, vegan_diet low_fat_diet high_fiber_diet ketogenic_diet,240
meal_id219,mother christmas cake,cake,"tart apples (2 large), sugar, apple juice, eggs, vegetable oil, vanilla extracts, all-purpose flour, apple pie spice (cinnamon), salt, pecans, candied red cherries (halved), candied green cherried (halved), candied pineapple (diced), cashews (optional)",veg,potassium, pregnancy, low_fat_diet high_fiber_diet ketogenic_diet,595
meal_id220,matcha tea macarons,tea,"egg whites, breakfast sugar, icing sugar, almond powder, matcha powder, heavy cream, white chocolate",veg,vitamin_a, heart_disease, ketogenic_diet hormone_diet,355
meal_id221,"amaranthus granola with lemon yogurt, berries and marigold",yogurt,"popped amaranthus (cholai), oats, almonds, cinnamon powder, sunflower seeds, sesame seeds, honey, brown sugar, salt, olive oil, lemon rind, plain yogurt (whipped with lemon rind), blueberries",veg,calcium, pregnancy hypertension scurvy heart_disease goitre kidney_disease obesity, low_fat_diet omni_diet Mediterranean_diet ketogenic_diet low_sodium_diet vegan_diet high_protien_diet dash_diet,320
meal_id222,chocolate fudge cookies,cookie,"dark chocolate coverture, butter, sugar, eggs, flour, baking powder, salt, cocoa powder, vanilla essence",veg,magnesium, hypertension heart_disease, high_protien_diet high_fiber_diet ketogenic_diet,230
meal_id223,veg summer rolls,rice,"rice paper sheets, iceberg lettuce, carrot, bean sprouts, cucumber, tofu, basil, mint leaves, coriander, rice noodles (soaked in warm water for 20-25 minutes), peanuts, hoisin sauce, peanuts, garlic, oil, red chillies, water",veg,carbohydrates, diabeties, high_protien_diet,545
meal_id224,eggless vanilla cake,cake,"maida, baking powder, castor sugar, butter, milk, vanilla essence, vinegar",veg,potassium, goitre, low_fat_diet high_fiber_diet ketogenic_diet,645
meal_id225,sweet potato pie,pie,"yams (red skinned), condensed milk, sugar, egg , cinnamon , marshmallows ,",veg,vitamin_a, hypertension scurvy goitre kidney_disease pregnancy, alkaline_diet low_fat_diet paleo_diet Mediterranean_diet low_sodium_diet gluten_free_diet high_fiber_diet high_protien_diet dash_diet,680
meal_id226,wok tossed asparagus in mild garlic sauce,sauce,"asparagus, 1 fried onion (medium), 1/2 tsp breakfast sugar, 10 ml potato starch, 20 ml stock vegetarian, 20 gm porcini, salt to taste, 50 ml oil",veg,chloride, hypertension cancer scurvy heart_disease kidney_disease pregnancy diabeties, alkaline_diet dash_diet low_fat_diet type_a_diet,615
meal_id227,cinnamon oatmeal pancakes,pancakes,"rolled oats, buttermilk (divided), whole wheat flour or oat flour, baking powder, baking soda, cinnamon, salt, eggs, canola oil , honey or maple syrup,",veg,selenium, hypertension cancer rickets goitre obesity diabeties, high_protien_diet vegan_diet low_fat_diet ketogenic_diet,215
meal_id228,chocolate chip cheesecake,chocolate,"butter biscuits (broken into pieces), butter (softened), cream cheese (softened), sugar, egg, rose essence or vanilla essence, chocolate chips",veg,calcium, hypertension heart_disease, low_fat_diet ketogenic_diet vegan_diet high_fiber_diet high_protien_diet,450
meal_id229,chocolate lava cake,cake,"dark chocolate, butter, icing sugar, egg yolks +  whole eggs, flour",veg,vitamin_a, hypertension heart_disease, high_fiber_diet ketogenic_diet,280
meal_id230,eggless coffee cupcakes,coffee,"maida/ flour, baking powder, sugar, cocoa powder, vanilla essence, butter (softened, salted. in case you are using unsalted butter, add 1/4 tsp salt), milk (to make the batter smooth. adjust the milk quantity according to your batter's smoothness), coffee powder + 1 tsp water, to make a paste (you can increase or decrease according to your coffee tolerance)",veg,vitamin_d, pregnancy anemia, ketogenic_diet hormone_diet,220
meal_id231,chicken in white wine,wine,"black pepper, plain flour, olive or sunflower oil, rashers lean bacon, onions or shallots  (cut in half), mushrooms, butter, boneless and skinless chicken breasts (chopped into 3cm pieces), dry white wine, chicken or vegetable stock, garlic cloves, bay leaves, fresh thyme sprigs (washed or 1/2 tsp dried thyme)",non-veg,iron, anemia pregnancy scurvy rickets goitre kidney_disease obesity, low_fat_diet omni_diet low_carb_diet vegan_diet high_fiber_diet hormone_diet high_protien_diet type_a_diet,555
meal_id204,chocolate and almond rum ball h,almond,"चॉकलेट स्पॉज एगलेस, डार्क चॉकलेट, सिंगल क्रीम, बादाम, कैस्टर शुगर, इंस्टेंट कॉफी पाउडर, डार्क रम",veg,magnesium, hypertension heart_disease, high_protien_diet high_fiber_diet ketogenic_diet gluten_free_diet,450
meal_id232,apple and walnut cake,cake,"सेब, अंडे, अखरोट, चीनी, अखरोट, तेल, मैदा, बेकिंग पाउडर, दालचीनी पाउडर",veg,potassium, obesity diabeties, high_protien_diet low_fat_diet high_fiber_diet ketogenic_diet,510
meal_id7,chocolate nero cookies,cookie,"बादाम, अंडे, चीनी (पीसी हुई), चॉकलेट (हल्की मीठी), मक्खन, मैदा, बेकिंग पाउडर, कैस्टर शुगर, आइसिंग शुगर",veg,magnesium, hypertension heart_disease, high_protien_diet high_fiber_diet ketogenic_diet,685
meal_id233,gluten free almond cake,cake,"बादाम पाउडर, अंडा, शहद , बेकिंग सोडा, वनिला एसेंस, नमक, शहद, बादाम",veg,potassium, hypertension heart_disease goitre kidney_disease obesity diabeties, low_fat_diet ketogenic_diet vegan_diet high_fiber_diet hormone_diet gluten_free_diet,635
meal_id234,cinnamon star cookies,cookie,"मक्खन, कैस्टर शुगर, क्रिसमस मिक्स स्पाइसी, दालचीनी पाउडर, शहद, ग्लूकोज, क्रीम, कुट्टू का आटा, बेकिंग सोडा, ब्रेड फलार",veg,protien, cancer diabeties hypertension, ketogenic_diet,530
